SentenceID,CodeSwitchedSentence,IndicesOfCodeSwitchedWord,IndicesOfPunctuation,TranslatedSentence,AddedWordList
379,图片 详见 google docs 的 文件 分享 。,[2_3],[7],图片 详见 谷歌文档 的 文件 分享 。,
380,紧邻 high school ， ymca 等 运动 场所 。,[1_2_3_4],[3_8],紧邻 高中，健身房 等 运动 场所 。,
381,5'' 口径 的 rack 。,[0_3_4],[4],5'' 口径 的 齿条。,
382,park crest terrace 是 state college 性价比 最高 的 小区 。,[0_1_2_4_5],[10],帕克克莱斯特叠层房 是 斯泰特克里奇 性价比 最高 的 小区 。,
383,求 ride !,[1_2],[2],求搭车！,
384,具体 产品 信息 可以 参考 amazon .,[5_6],[6],具体 产品 信息 可以 参考亚马逊,
385,更正 联系 信息 ： 请 发送 email 至 em@8,[6],[3_8],更正 联系 信息 ： 请 发送 电子邮箱至 em@8,
386,heights 小区 健身房 ， 游泳池 隔壁 。,[0],[3_6],海慈小区 小区 健身房 ， 游泳池 隔壁 。,
387,circle 社区 ( stratford,[0_3],[2],圆形 社区 ( 斯特拉特福德,
388,very good condition ， clean title ， no accident history ， pa inspected ， 报价 $7，000 ， 可以 议价 。,[0_1_2_3_4_5_6_7_8_9_10_11_12_13],[3_6_10_13_16_19],好条件 ， 干净的头衔 ， 没有事故历史，宾州检验。报价 $7，000 ， 可以 议价 。,
389,american eagle 全 新 时尚 墨镜 。,[0_1],[6],美国鹰全 新 时尚 墨镜 。,
390,可 代为 与 office 联系 并 争取 ！,[3],[7],可 代为 与 办公室 联系 并 争取 ！,
391,可 代为 与 office 联系 并 争取 ！,[3],[7],可 代为 与 办公室 联系 并 争取 ！,
392,bryn 房间 出租,[0],,布莱恩小区 房间 出租,
393,有偿 求 ride ， 7 .,[2_3_4_5],[3_5],有偿 求 搭车， 7.,[7]
394,ding ， ， 顶 ， 顶,[0_1_2],[1_2_4],顶，，顶，顶,
395,两 个 人 去 harrisburg 考 托福 ， 计划 9 .,[4],[7_10],两 个 人 去 哈里斯堡考 托福 ， 计划 9.,[9]
396,求 组团 求 ride 。,[3_4],[4],求 组团 求 搭车。,
397,小区 环境 优美 安静 ， 物业 非常 nice 。,[7_8],[4_8],小区 环境 优美 安静 ， 物业 非常 友善。,
398,本人 是 一 个 安静 整洁 无 不良 习惯 不 开 party 的 女生 。,[11],[14],本人 是 一 个 安静 整洁 无 不良 习惯 不 开 派对 的 女生 。,
400,toaster ， monitor 已 出,[0_1_2],[1],面包机，显示屏已 出,
401,【 the one 智能 电子琴 】 已 出,[0_1_2],[0_5],【 唯一智能 电子琴 】 已 出,
403,绝大多数 得到 心仪 offer 的 同学 ， 都 赢 在 了 起跑线 上 。,[3],[6_13],绝大多数 得到 心仪 录取通知书 的 同学 ， 都 赢 在 了 起跑线 上 。,
404,每 周 工作 5~10hr ， 远程 工作 ， 完全 flexible 。,[9_10],[4_7_10],每 周 工作 5~10hr ， 远程 工作 ， 完全 时间灵活,
405,有 没 有 同学 在 这个 online data analytics degree program-business option 这个 program 的 ？,[6_7_8_9_10_11_13],[15],有 没 有 同学 在 这个在线数据分析等级选项-商科选项 这个 项目的 ？,
406,可以 给 我 email : em@9,[3_4_5],[4_5],可以 给 我邮件 : em@9,
407,你 是 full time 学生 吗 ？,[2_3],[6],你 是 全日制学生 吗 ？,
408,是 不 是 都 是 team projects ?,[5_6_7],[7],是 不 是 都 是 小组项目？,
409,full size 床 ！,[0_1],[3],单人床！,
410,内容 不难 ， 但是 一 周 三 个 作业 三 个 quiz ， 两 周 一 个 exam ， 建议 在 暑假 这 种 比较 清闲 的 学期 上 。,[11_12_17_18],[2_12_18_29],内容 不难 ， 但是 一 周 三 个 作业 三 个 测验 ， 两 周 一 个 考试， 建议 在 暑假 这 种 比较 清闲 的 学期 上 。,
411,打包 free ！,[1_2],[2],打包免费！,
412,拍照 free !,[1_2],[2],拍照免费！,
413,闲暇 之 余 考 了 pa 的 property&casualty 和 life 的 保险 执照 。,[5_9],[13],闲暇 之 余 考 了 宾州 的 财产与意外 和 生命 的 保险 执照 。,
414,一 年 lease 。,[2_3],[3],一年租房合同,
415,送 king size 床 ~ 所有 家具 全 送 。,[1_2],[4_9],送 二米二宽的 床 ~ 所有 家具 全 送 。,
416,请 问 j2 能 申请 penn state id card 吗 ？,[2_5_6_7_8],[10],请 问 j2签证 能 申请 宾州身份证 吗 ？,
417,还 有 一 个 优点 就 是 这里 很 安静 ， 有些 混 住 的 旁边 美国人 喜欢 开 party 的 ， 周末 很 吵 。,[19],[10_21_25],还 有 一 个 优点 就 是 这里 很 安静 ， 有些 混 住 的 旁边 美国人 喜欢 开派对 的 ， 周末 很 吵 。,
418,强烈 不 建议 的 ， 有 monroe ， pep boy 。,[6_7_8_9_10],[4_7_10],强烈 不 建议 的 ， 有 门罗 ， 佩普男 。,
420,强烈 不 建议 的 ， 有 monroe ， pep boy 。,[6_7_8_9_10],[4_7_10],强烈 不 建议 的 ， 有 门罗 ， 佩普男 。,
422,一 楼 一 个 卧室 ， 三 楼 两 个 卧室 ， 二 层 （ 公用 ） 是 living room ， 厨房 ， 1/2 卫生间 ， 阳台 。,[18_19_20],[5_11_14_16_20_22_25_27],一 楼 一 个 卧室 ， 三 楼 两 个 卧室 ， 二 层 （ 公用 ） 是 客厅 ， 厨房 ， 1/2 卫生间 ， 阳台 。,
423,小区 以 professional 住户 为主 。,[2],[5],小区 以 有职业的 住户 为主 。,
424,具体 户型 可 参考 如下 图片 中 的 two bedroom traditional 。,[8_9_10_11],[11],具体 户型 可 参考 如下 图片 中 的两个卧室的常规。,
425,park crest terrace 是 state college 性价比 最高 的 小区 。,[0_1_2_4_5],[10],帕克克莱斯特复式楼是斯泰特克里奇里性价比最高的小区。,
426,因为 是 新 lease ， 所以 房子 非常 干净 。,[3_4],[4_9],因为 是 新 租房合同 ， 所以 房子 非常 干净 。,
427,访 学 男 老师 ， 十月 初 左右 到 penn state 。,[9_10_11],[4_11],访 学 男 老师 ， 十月 初 左右 到宾州州立,
428,即使 iso 可以 通过 ， 强烈 建议 不 要 购买 iso ， 几乎 跟 没 保 一样,[1_10_11],[4_11],即使 国际学生保险 可以 通过 ， 强烈 建议 不 要 购买 国际学生保险， 几乎 跟 没 保 一样,
429,车 一直 在 dealer 保养 （ 有 票据 ） ， 四月 底 才 保养 过 。,[3],[5_8_9_15],车 一直 在汽车管理保养 （ 有 票据 ） ， 四月 底 才 保养 过 。,
430,打包 free ！,[1_2],[2],打包免费！,
431,拍照 free !,[1_2],[2],拍照免费!,
432,地址 ： west cherry lane ， state college 附近 环境 ： 离 东方 超市 ， giant 超市 步行 五 分钟 距离 。,[2_3_4_5_6_7_15],[1_5_10_14_21],地址 ： 西车厘路 ， 伟大超市 附近 环境 ： 离 东方 超市 ， 伟大 超市 步行 五 分钟 距离 。,
433,可以 办 学校 的 ride pass .,[4_5_6],[6],可以 办 学校 的 搭车卡,
434,lease 可以 在 入住 后 去 房东 那里 签 。,[0],[9],租房合同 可以 在 入住 后 去 房东 那里 签 。,
435,今天 起 available ， 到 明年 8 .,[2_3],[3_7],今天 起有空 ， 到 明年 8.,[8]
436,赠送 gre 书,[1],,赠送 研究生考试 书,
437,已经 打算 入手 他们 medium soft 的 了 。,[4_5],[8],已经 打算 入手 他们 媒体软件 的 了 。,
438,我 有 prime 所以 没有 邮费 。,[2],[6],我 有 亚马逊会员 所以 没有 邮费 。,
439,停车 免费 ， 不 需要 注册 随便 停 ， 朋友 开车 来 visit 也 不用 担心 没有 地方 停车 。,[12],[2_8_19],停车 免费 ， 不 需要 注册 随便 停 ， 朋友 开车 来访客停车位 也 不用 担心 没有 地方 停车 。,
440,bonus ： 因 现 住户 需要 回国 ， 如 确认 签约 ， 大部分 家具 免费 附送 （ 总 价值 逾 千 刀 ） 。,[0_1],[1_7_11_16_22_23],附加 ： 因 现 住户 需要 回国 ， 如 确认 签约 ， 大部分 家具 免费 附送 （ 总 价值 逾 千 刀 ） 。,
441,just dance 是 什么 意思 ？,[0_1],[5],跳舞是什么意思,
442,the heights 后面 住宅 小区 的 single house .,[0_1_6_7_8],[8],海慈小区 后面 住宅 小区 的 独栋房,[house]
443,坐 bus 到 学校 要 多久 啊 ？,[1],[7],坐 公交车到 学校 要 多久 啊 ？,
444,降价 ， ding ~,[2_3],[1_3],降价 ， 叮~,
445,屋内 其余 两 位 都 是 女 phd ， 离开 的 这 位 也 是 phd ， 所以 房屋 环境 安静 ， 适合 学习 。,[7_8_15_16],[8_16_21_24],屋内 其余 两 位 都 是 女 博士生 ， 离开 的 这 位 也 是 博士生 ， 所以 房屋 环境 安静 ， 适合 学习 。,
446,deal 的 有 链接 吗 ？,[0],[5],处理 的 有 链接 吗 ？,
447,求 8/17 早上 去 纽约 的 ride ， 需要 三 个 位置 ， 愿意 付 全部 的 toll and gas 。,[6_7_17_18_19_20],[7_12_20],求 8/17 早上 去 纽约 的 搭车 ， 需要 三 个 位置 ， 愿意 付 全部 的 过路费和油费,
448,求 村里 短 租 一 个 bedroom ， 时间 8 .,[6_7],[7_10],求 村里 短 租 一 个 卧室 ， 时间 8.,[8]
449,各 种 折扣 theme,[3],,各 种 折扣主题,
450,各 种 show,[2],,各 种表演,
451,du soleil ， las vegas 好多 城市 的,[0_1_2_3_4],[2],杜苏蕾，拉斯维加斯 好多 城市 的,
452,（ 原价 ： gate price = $ 74 .,[0_3_4_5_6_7_8],[0_2_5_6_8],（ 原价 ： 原价 = $ 74.,[74]
453,token 已 出,[0],,公交币已 出,
454,harman/kardon sound 音响 系统,[0_1],,哈曼卡丹声音音响 系统,
455,navigation system 导航,[0_1],,航行系统导航,
456,有 整 套 洗车 工具 ， 只要 不 是 final 期间 特别 忙 的 时候 ， 不 能 说 一尘不染 但 绝 不 会 有 肉眼 可 见 的 污点 。,[9],[5_15_30],有 整 套 洗车 工具 ， 只要 不是期末考试 期间 特别 忙 的 时候 ， 不 能 说 一尘不染 但 绝 不 会 有 肉眼 可 见 的 污点 。,
457,从 车 到手 一直 是 state farm 全 保,[5_6],,从 车 到手 一直 是 州农场全 保,
458,附近 有 东方 超市 和 giant .,[5_6],[6],附近 有 东方 超市 和 伟大超市,
459,求购 一 枚 modem ， 俗称 猫 ， 最好 是 cable 3 .,[3_4_10_11_12],[4_7_12],求购 一 枚 调制解调器 ， 俗称 猫 ， 最好 是 凯博2,[3]
460,pass 还 在 吗 ？,[0],[4],证还在吗,
461,刚刚 google 一下 “ em@6,[1],[3_4],刚刚 谷歌 一下 “ em@6,
462,联系 candy em@10,[1_2],[2],联系 em@11,
463,the heights 后面 住宅 小区 的 single house .,[0_1_6_7_8],[8],海慈小区 后面 住宅 小区 的独栋小区 .,
464,联系 电话 pn-4 ， email em@12,[4_5],[2_3_5],联系 电话 pn-4 ，邮箱 em@12,
465,因 搬到 furnished 公寓 带 了 家具 ， 出售 自用 家具 。,[2],[7_11],因 搬到有家具的 公寓 带 了 家具 ， 出售 自用 家具 。,
466,搬家 出售 一 张 木质 书桌 ， 有 三 个 大 抽屉 ， size : 43 .,[13_14_15_16],[6_12_14_16],搬家 出售 一 张 木质 书桌 ， 有 三 个 大 抽屉 ， 尺寸: 43.,[43]
467,无 事故 ， 保养 换 了 新 电池 ， 火花塞 ， valve cover gasket 。,[11_12_13_14],[2_8_10_14],无 事故 ， 保养 换 了 新 电池 ， 火花塞 ， 阀门覆盖垫圈,
468,请教 个 问题 哈 ， 你们 小区 （ lions gate ） 拖车 吗 ？,[8_9_10],[4_7_10_13],请教 个 问题 哈 ， 你们 小区 （ 狮子门小区 ） 拖车 吗 ？,
469,请教 个 问题 哈 ， 你们 小区 （ lions gate ） 拖车 吗 ？,[8_9_10],[4_7_10_13],请教 个 问题 哈 ， 你们 小区 （ 狮子门小区 ） 拖车 吗 ？,
470,请教 个 问题 哈 ， 你们 小区 （ lions gate ） 拖车 吗 ？,[8_9_10],[4_7_10_13],请教 个 问题 哈 ， 你们 小区 （ 狮子门小区 ） 拖车 吗 ？,
471,请教 个 问题 哈 ， 你们 小区 （ lions gate ） 拖车 吗 ？,[8_9_10],[4_7_10_13],请教 个 问题 哈 ， 你们 小区 （ 狮子门小区 ） 拖车 吗 ？,
472,请教 个 问题 哈 ， 你们 小区 （ lions gate ） 拖车 吗 ？,[8_9_10],[4_7_10_13],请教 个 问题 哈 ， 你们 小区 （ 狮子门小区 ） 拖车 吗 ？,
473,guest parking 还 需要 permit 吗 ？,[0_1_4],[6],访客停车位 还 需要 停车牌 吗 ？,
474,请教 个 问题 哈 ， 你们 小区 （ lions gate ） 拖车 吗 ？,[8_9_10],[4_7_10_13],请教 个 问题 哈 ， 你们 小区 （ 狮子门小区 ） 拖车 吗 ？,
475,guest parking 还 需要 permit 吗 ？,[0_1_4],[6],访客停车位 还 需要 停车牌 吗 ？,
476,刚刚 收到 邮件 通知 j-1 新 一 年 的 保险 要求 ， 不 清楚 还有 没 有 性价比 较 高 的 校外 保险 可 做 waive 。,[4_25_26],[11_26],刚刚 收到 邮件 通知 j-1 新 一 年 的 保险 要求 ， 不 清楚 还有 没 有 性价比 较 高 的 校外 保险 可 做 换权搁置,
477,小区 parkway plaza ， 一 室 一 厅 ， 2017 .,[1_2_3],[3_8_10],小区花园路广场 ， 一 室 一 厅 ， 2017.,[2017]
479,目前 住 有 两 名 访问 学者 ( 男生 ) ， 人 都 很 nice ， 平时 可 一起 出行 购物 ， 周末 一起 出游 娱乐 。,[14_15],[7_9_10_15_21_26],目前 住 有 两 名 访问 学者 ( 男生 ) ， 人 都 很 友善 ， 平时 可 一起 出行 购物 ， 周末 一起 出游 娱乐 。,
481,rc ， 到 学校 和 downtown 非常 方便 。,[0_1_5],[1_8],rc ， 到 学校 和 市中心 非常 方便 。,
482,printer / 打印机,[0_1],[1],打印机/打印机,
483,以下 是 amazon 的 介绍 网页 。,[2],[6],以下 是亚马逊 的 介绍 网页 。,
484,二 层 是 三 间 卧室 和 两 个 full bathrooms 。,[9_10_11],[11],二 层 是 三 间 卧室 和 两 个 带浴缸的卫生间,
485,我 找 不 到 房子 的 floor plan 。,[6_7_8],[8],我 找 不 到 房子 的 房型预览,
486,两 名 physics phd 男生 ， 行李 不多 ， 没有 什么 家具 ， 一切 都 好 商量 ， 希望 有 多余 房间 的 同学 能 提供 一下 住处 。,[2_3],[5_8_12_17_28],两名物理博士 男生 ， 行李 不多 ， 没有 什么 家具 ， 一切 都 好 商量 ， 希望 有 多余 房间 的 同学 能 提供 一下 住处 。,
487,可以 一起 租车 开 回来 或者 有偿 求 ride ， 可以 帮忙 开 。,[8_9],[9_13],可以 一起 租车 开 回来 或者 有偿 求 搭车 ， 可以 帮忙 开 。,
488,因 本人 的 新 lease 8 .,[4_5_6],[6],因 本人 的 新 租房合同 8.,[8]
489,只是 前提 是 你 需要 在 bank of america ( boa ) 的 checking account 里 存款 达到 一定 数额 。,[6_7_8_9_10_11_13_14],[9_11_20],只是 前提 是 你 需要 在 美国银行的活期存款账户 里 存款 达到 一定 数额 。,
490,接下来 amex 会 email 给 你 一 个 电话 号码 ， 打 过去 之后 把 你 的 护照 号 报 上去 就 可以 了 。,[1_3],[10_24],接下来美国证券交易所 会 发邮件 给 你 一 个 电话 号码 ， 打 过去 之后 把 你 的 护照 号 报 上去 就 可以 了 。,
491,只是 前提 是 你 需要 在 bank of america ( boa ) 的 checking account 里 存款 达到 一定 数额 。,[6_7_8_9_10_11_13_14],[9_11_20],只是 前提 是 你 需要 在 美国银行的活期存款账户 里 存款 达到 一定 数额 。,
492,chase 5/24 在 拿到 第一 张 卡 并且 信用 记录 长度 足够 之后 ， 理论 上 来讲 就 可以 随便 申 卡 了 。,[0_1],[13_23],大通银行 5/24 在 拿到 第一 张 卡 并且 信用 记录 长度 足够 之后 ， 理论 上 来讲 就 可以 随便 申 卡 了 。,
493,但是 chase 一部分 很 好 的 信用卡 受到 一 个 特殊 规则 的 影响 ： 两 年 五 卡 政策 （ 5/24 rule ） 。,[1_22_23_24],[14_20_23_24],但是 大通银行一部分 很 好 的 信用卡 受到 一 个 特殊 规则 的 影响 ： 两 年 五 卡 政策 （ 5/24 规定）。,
494,这个 新 账户 的 定义 不仅仅 包含 chase 自家 的 信用卡 ， 而是 包含 所有 信用卡 。,[7],[11_16],这个 新 账户 的 定义 不仅仅 包含 大通银行 自家 的 信用卡 ， 而是 包含 所有 信用卡 。,
495,其中 比较 推荐 申请 几 张 如下 ： chase freedom 在 这个 阶段 不要 太 心急 ， 花 几 个 月 的 时间 慢慢 申 就好 ， 否则 很 容易 被 拒 。,[8_9],[7_16_26_32],其中 比较 推荐 申请 几 张 如下 ： 大通银行自由行 在 这个 阶段 不要 太 心急 ， 花 几 个 月 的 时间 慢慢 申 就好 ， 否则 很 容易 被 拒 。,
498,我 找 了 很久 floor plan ， 但是 真的 真的 没有 找到 。,[4_5_6],[6_12],我 找 了 很久 房型预览， 但是 真的 真的 没有 找到 。,
499,要求 ： graduate student 及 以上 优先 。,[2_3],[1_7],要求 ： 研究生及 以上 优先 。,
500,undergraduate 学生 能 满足 物业 条件 也 可以 。,[0],[8],本科 学生 能 满足 物业 条件 也 可以 。,
501,lease 8/1 开始 到 明年 7/31一 年 。,[0_1],[7],租房合同8/1 开始 到 明年 7/31一 年 。,
502,不 接受 其他 lease 。,[3_4],[4],不 接受 其他 租房合同。,
503,state college 价钱 可 商量 ， 有 兴趣 请 联系 ！,[0_1],[5_10],斯泰特克里奇 价钱 可 商量 ， 有 兴趣 请 联系 ！,
504,lease 是 单独 签 这 一 间 卧室 ， 不 跟 别人 搅和 。,[0],[8_13],租房合同是单独 签 这 一 间 卧室 ， 不 跟 别人 搅和 。,
505,卧室 里 配 的 是 queen size 的 床 （ 相当于 国内 1 .,[5_6],[9_13],卧室 里 配 的 是 一米五宽的 床 （ 相当于 国内 1.,[1]
506,啊 勘误 ， queen size 的 床 是 一 米 五 的 ！,[3_4],[2_12],啊 勘误 ， 一米五宽的 床 是 一 米 五 的 ！,
507,第二 年 开始 ， 是否 继续 ta 要看 导师 有 没 有 funding 给 你 付 工资 和 学费 ， 很少 有 五 年 都 ta 的 人 ， 也 很 少 有 五 年 都 ra 的 人,[6_12_25_36],[3_19_28],第二 年 开始 ， 是否 继续 教学助理 要看 导师 有 没 有资金给 你 付 工资 和 学费 ， 很少 有 五 年 都 教学助理 的 人 ， 也 很 少 有 五 年 都 宿舍管理的 人,
508,我 的 联系 方式 ： email : em@13,[5_6_7],[4_6_7],我 的 联系 方式 ：邮箱: em@13,
509,我 的 email : em@14,[2_3_4],[3_4],我 的邮箱 : em@14,
510,打包 free ！,[1_2],[2],打包免费！,
511,拍照 free !,[1_2],[2],照相免费！,
512,更新 条件 为 到 ist building 近 一点 ， 公交 频率 高 一点 。,[4_5],[8_13],更新 条件 为 到 ist教学楼近 一点 ， 公交 频率 高 一点 。,
513,不 包含 各 种 utilities 。,[4_5],[5],不 包含 各 种 公共设施。,
514,floor plan 如下 ：,[0_1],[3],房型预览 如下 ：,
515,请 联系 email : em@15,[2_3_4],[3_4],请 联系 邮箱: em@15,
516,代 八月 来 这儿 的 一 个 phd 朋友 发 的 。,[7],[11],代 八月 来 这儿 的 一 个 博士生 朋友 发 的 。,
517,要求 爱 干净 ， 不 要 party prince ， 不 养 宠物 。,[6_7_8],[3_8_12],要求 爱 干净 ， 不 要 爱派对的女孩 ， 不 养 宠物 。,
518,请 联系 微 信 ： rodin_9403 注明 ride,[7],[4],请 联系 微 信 ： rodin_9403 注明 搭车,
519,up ， lease 至 明年 暑假,[0_1_2],[1],帕克校区，租房合同 至 明年 暑假,
521,没 问题 ， 这 车 是 我 出差 nyc 和 dc 的 主力 。,[8_10],[2_13],没 问题 ， 这 车 是 我 出差 纽约 和华盛顿的 主力 。,
522,房子 到 bus 站 一 分钟 就 能 走到 ， 去 学校 非常 方便 ；,[2],[9_14],房子 到 公交站 一 分钟 就 能 走到 ， 去 学校 非常 方便 ；,
523,所以 all in all 每 个 月 花费 只 约 六百 刀 搞定 。,[1_2_3],[13],所以 所有包含 每 个 月 花费 只 约 六百 刀 搞定 。,
524,具体 lease 时间 2017 .,[1],[4],具体 租房合同 时间 2017.,[2017]
525,park forest villas 一 室 一 厅 。,[0_1_2],[7],帕克森林别墅一室一厅,
527,可以 直接 送到 world trade center 吗 ？,[3_4_5],[7],可以 直接 送到 世界贸易中心吗 ？,
528,可以 直接 送到 world trade center 吗 ？,[3_4_5],[7],可以 直接 送到 世界贸易中心吗 ？,
529,填 ds-2019 表 信息 的 网页 上 ， 好像 说 的 是 ， 只要 满足 各 种 赔付 额 条件 的 保险 都 可以 申请 waiver,[1_25],[7_12],填 ds-2019 表 信息 的 网页 上 ， 好像 说 的 是 ， 只要 满足 各 种 赔付 额 条件 的 保险 都 可以 申请 弃权书,
530,女生 phd ， 请 问 房子 还 可以 租 吗 ？,[1_2],[2_10],女生 博士 ， 请 问 房子 还 可以 租 吗 ？,
531,里程 数 ： 60，000 mile 左右 。,[4],[2_6],里程 数 ： 60，000 英里 左右 。,
532,bose 音响 。,[0],[2],博士音响,
533,不 走 gift 。,[2_3],[3],礼物模式,
534,邮件 已 回 ~ 不 知道 这个 bbs 怎么 点 回复 啊 。,[7],[3_12],邮件 已 回 ~ 不 知道 这个 美国二手网 怎么 点 回复 啊 。,
535,有偿 求 ride ， 可以 一起 租车 走 ！,[2_3],[3_8],有偿 求 搭车， 可以 一起 租车 走 ！,
536,求 ride ， 非常 感谢,[1_2],[2],求 搭车 ， 非常 感谢,
538,） 岁 以上 跟 学校 的 差不多 价格 ， 大概 是 $300 / month,[0_13],[0_8_12],） 岁 以上 跟 学校 的 差不多 价格 ， 大概 是 $300 / 月,
539,再者 waiver 填 表格 麻烦 吗 ？,[1],[6],再者弃权填 表格 麻烦 吗 ？,
540,欢迎 站 内 或 联系 candy em@10,[5_6],[6],欢迎 站 内 或 联系 em@11,
541,如 标题 ， 求 几 天 短 租用 来 寻 个 住处 在 我 两 个 房屋 lease 之间 过渡 。,[17],[2_20],如 标题 ， 求 几 天 短 租用 来 寻 个 住处 在 我 两 个 房屋 租房合同 之间 过渡 。,
542,欢迎 站 内 或 联系 candy em@10,[5_6],[6],欢迎 站 内 或 联系 em@11,
543,有偿 求 ride 。,[2_3],[3],有偿 求 搭车。,
544,学校 后面 的 lion surplus 里面 有 很多 ， 非常 划算 。,[3_4],[8_11],学校 后面 的 狮子盈余 里面 有 很多 ， 非常 划算 。,
545,打包 free ！,[1_2],[2],打包免费！,
546,拍照 free !,[1_2],[2],拍照免费！,
547,如果 有 喜欢 狗 狗 的 朋友 愿意 帮忙 照看 lucio ， 我 愿意 付 合适 的 酬劳 ， 并且 提供 狗 粮 、 狗 玩具 等 用品 。,[10_11],[11_18_23_28],如果 有 喜欢 狗 狗 的 朋友 愿意 帮忙 照看 卢西奥 ， 我 愿意 付 合适 的 酬劳 ， 并且 提供 狗 粮 、 狗 玩具 等 用品 。,
548,国内 ota 行业 no .,[1_3_4],[4],国内 职业疗法医生协会 行业 no.,[no]
549,你 要 去 nyc 还是 哪 啊 ？,[3],[7],你 要 去 纽约 还是 哪 啊 ？,
550,你 要 去 nyc 还是 哪 啊 ？,[3],[7],你 要 去 纽约 还是 哪 啊 ？,
551,你 要 去 nyc 还是 哪 啊 ？,[3],[7],你 要 去 纽约 还是 哪 啊 ？,
552,你 要 去 nyc 还是 哪 啊 ？,[3],[7],你 要 去 纽约 还是 哪 啊 ？,
553,距离 学校 开车 十 分钟 ， 也 有 公交 和 学校 的 shuttle ， 距离 超市 （ giant ） 非常 近 走路 可以 到 。,[12_13_17_18],[5_13_16_18_24],距离 学校 开车 十 分钟 ， 也 有 公交 和 学校 的 校车， 距离 超市 （ 伟大超市） 非常 近 走路 可以 到 。,
554,交通 方便 ， 小区 有 hp ， vn ， nv 线 。,[5_6_7_8_9],[2_6_8_11],交通 方便 ， 小区 有 hp ， vn ， nv 线 。,
555,clubhouse 有 免费 彩印 ， 复印 服务 。,[0],[4_7],活动室 有 免费 彩印 ， 复印 服务 。,
556,各位 师兄 师姐 ， 我 找 了 一 圈 房子 ， 最后 看到 imperial tower 还 可以 申请 ， 就 发 邮件 申请 了 。,[13_14],[3_10_18_24],各位 师兄 师姐 ， 我 找 了 一 圈 房子 ， 最后 看到 皇家塔 还 可以 申请 ， 就 发 邮件 申请 了 。,
557,车 是 自动 挡 automatic transmission 的 。,[4_5],[7],车 是 自动 挡 的 。,
558,价格 8200 $ ， cash only ， 当天 办理 title 转让 手续 。,[4_5_6_9],[2_3_6_12],价格 8200$ ， 只收现金 ， 当天 办理 台头 转让 手续 。,[8200]
559,帮忙 发 帖子 ~ 非常 好 的 房子 欢迎 联系 lease ： 7/14/2017 to 7/31/2018 .,[10_11_12_13_14_15],[3_11_15],帮忙 发 帖子 ~ 非常 好 的 房子 欢迎 联系 租房合同 ： 7/14/2017 至7/31/2018 .,
560,不过 这个 区域 是 不 太 适合 家庭 有 孩子 的 ， 我 在 state college 住 了 好 几 年 的 感觉 。,[14_15],[11_23],不过 这个 区域 是 不 太 适合 家庭 有 孩子 的 ， 我 在斯泰特克里奇【 住 了 好 几 年 的 感觉 。,
561,office 人 很 好 。,[0],[4],小区办公室,
562,出租 的 房间 是 二 层 两 个 bedroom 其中 的 一 间 。,[8],[13],出租 的 房间 是 二 层 两 个 卧室其中 的 一 间 。,
563,最好 是 男生 ， 如果 是 女生 需要 跟 另 一 个 男生 share 一 个 bathroom 。,[13_16_17],[3_17],最好 是 男生 ， 如果 是 女生 需要 跟 另 一 个 男生 共用一 个 卫生间。,
564,小区 提供 visitor parking 。,[2_3_4],[4],小区 提供 方可停车位 。,
565,还有 健身房 和 泳池 在 clubhouse 附近 。,[5],[7],还有 健身房 和 泳池 在 活动室 附近 。,
566,顺便 说 ： office 的 人 很 nice 的 ～,[3_7],[2_9],顺便 说 ： 官方办公室 的 人 很 好 的 ～、,
567,最近 找 房 看 了 一 圈 ， 表示 villas 往返 学校 的 交通 太 不 便利 了 ， 必须 得 有 车 ， 而且 客厅 和 房间 都 比较 小 。,[9],[7_18_23_31],最近 找 房 看 了 一 圈 ， 表示 独栋别墅返 学校 的 交通 太 不 便利 了 ， 必须 得 有 车 ， 而且 客厅 和 房间 都 比较 小 。,
568,可以 一起 租车 去 jfk ！,[4_5],[5],可以 一起 租车 去 肯尼迪机场！,
569,hi 同学 ， 你 找到 ride 了 吗 ？,[0_5],[2_8],你好同学，你找到搭车了吗。,
570,hi 同学 ， 你 找到 ride 了 吗 ？,[0_5],[2_8],你好同学，你找到搭车了吗。,
571,hi 同学 ， 你 找到 ride 了 吗 ？,[0_5],[2_8],你好同学，你找到搭车了吗。,
572,crest terrace 是 state college 性价比 最高 的 小区 。,[0_1_3_4],[9],克里斯特复式楼是 斯泰特克里奇 性价比 最高 的 小区 。,
573,hello 大家 好 ， 本人 男 ， 由于 新 apartment 要 到 8 .,[0_9],[3_6_13],嗨 大家 好 ， 本人 男 ， 由于 新 公寓要 到 8.,[8]
