SentenceID,CodeSwitchedSentence,NumberOfCodeSwitching,CodeSwitch1,CodeSwitch2,CodeSwitch3,CodeSwitch4
2967,一 个 american 一 个 black,2,american,black,,
2968,有 free off street parking lot,1,free off street parking lot,,,
2969,我 叫 sean,1,sean,,,
2970,我们 公司 有 一 个 在 业内 非常 有名 的 gmt 项目,1,gmt,,,
2971,m 除了 internet 其他 都 包括,2,m,internet,,
2972,phd 第二 年,1,phd,,,
2973,公认 全 state college 性价比 最高 的 房子,1,state college,,,
2974,电视 cable 等 所有 费用,1,cable,,,
2975,我 可以 和 你 换 ticket,1,ticket,,,
2976,家 住 downtown,1,downtown,,,
2977,购 于 amazon,1,amazon,,,
2978,在 executive house apartments,1,executive house apartments,,,
2979,在 executive house apartments,1,executive house apartments,,,
2980,在 executive house apartments,1,executive house apartments,,,
2981,或者 在 北面 giant 附近,1,giant,,,
2982,房间 在 executive house apartment,1,executive house apartment,,,
2983,请 联系 微 信 ethel,1,ethel,,,
2984,html 这 是 网址,1,html,,,
2985,不 开 party,1,party,,,
2986,可以 为 你 提供 mock interview 和 内 推,1,mock interview,,,
2987,target 也 很 近,1,target,,,
2988,人 非常 nice,1,nice,,,
2989,公寓 离 bus stop 稍 远 但 环境 安静 绝 不 会 吵闹,1,bus stop,,,
2990,需要 与 office 签署 正式 合同,1,office,,,
2991,有 自己 的 washer 和 dryer,2,washer,dryer,,
2992,park crest 客房 出租,1,park crest,,,
2993,两 人 share 一 个 卫生间,1,share,,,
2994,门口 有 多 条 lines 经过,1,lines,,,
2995,以及 walk in closet,1,walk in closet,,,
2996,包括 full size 的 床,1,full size,,,
2997,早上 出发 到 philadelphia,1,philadelphia,,,
2998,parkway plaza 一 室 一 厅 一 卫,1,parkway plaza,,,
2999,可 上 parkway plaza 的 官 网 查看,1,parkway plaza,,,
3000,可以 随时 与 office 续签,1,office,,,
3001,药店 rite aid,1,rite aid,,,
3002,good will 和 pete,2,good will,pete,,
3003,和 mock interview,1,mock interview,,,
3004,parkway plaza 一 室 一 厅 一 卫,1,parkway plaza,,,
3005,可以 随时 与 office 续签,1,office,,,
3006,药店 rite aid,1,rite aid,,,
3007,good will 和 pete,2,good will,pete,,
3008,请 邮件 future,1,future,,,
3009,talker 联系 方式,1,talker,,,
3010,踞 downtown 开车 五 分钟,1,downtown,,,
3011,twin size 的 床 一 张,1,twin size,,,
3012,找到 以后 share 一下 吧,1,share,,,
3013,包含 bus pass,1,bus pass,,,
3014,up up 价格 可以 商量,1,up up,,,
3015,toaster 太 可爱 了 啊,1,toaster,,,
3016,office 技能 与 国内 教育 资源 有 联系 者 优先,1,office,,,
3017,mba 毕业 优先,1,mba,,,
3018,求 分享 一 条 line,1,line,,,
3019,电视 cable 等 所有 maintenance 费用,2,cable,maintenance,,
3020,全 state college 性价比 最高,1,state college,,,
3021,准备 搞 一 个 garage sale,1,garage sale,,,
3022,garage sale 暂 定 周四 和 周五 两 个 下午,1,garage sale,,,
3023,准备 搞 一 个 garage sale,1,garage sale,,,
3024,我 分别 告诉 大家 garage sale 的 地址,1,garage sale,,,
3025,sharing 感 兴趣 请 联系,1,sharing,,,
3026,能 成功 被 学校 waive 的 谢谢,1,waive,,,
3027,图片 请 参考 http,1,http,,,
3028,喜欢 请 联系 微 信 ethel,1,ethel,,,
3029,微 信号 lei,1,lei,,,
3030,以及 walk in closet,1,walk in closet,,,
3031,包括 full size 的 床,1,full size,,,
3032,frame 也 可以,1,frame,,,
3033,不 开 party,1,party,,,
3034,与 office 签署 正式 合同,1,office,,,
3035,html 参考 图片,1,html,,,
3036,家 在 park crest,1,park crest,,,
3037,因为 没 车 所以 不 能 deliver,1,deliver,,,
3038,以及 walk in closet,1,walk in closet,,,
3039,包括 full size 的 床,1,full size,,,
3040,学校 计算机 lab 同 款,1,lab,,,
3041,只好 用到 google drive 了,1,google drive,,,
3042,你 的 google drive 显示 里面 没有 照片 啊,1,google drive,,,
3043,免 security deposit,1,security deposit,,,
3044,只 需 付 amenities package,1,amenities package,,,
3045,lounge and pool access 和 one,2,lounge and pool access,one,,
3046,是 今年 刚 修好 的 apartment,1,apartment,,,
3047,有 兴趣 的 请 联系 邮箱 lizzie,1,lizzie,,,
3048,开车 回到 sce,1,sce,,,
3049,请 联系 微 信 ethel,1,ethel,,,
3050,有 这 周末 去 premium crossing,1,premium crossing,,,
3051,有 这 周末 去 premium crossing,1,premium crossing,,,
3052,这 周末 去 premium crossing,1,premium crossing,,,
3053,park crest 的 好处 大家 都 知道,1,park crest,,,
3054,和 office 重新 签,1,office,,,
3055,反正 已经 成功 waive 啦,1,waive,,,
3056,听说 cover hpv 三联 疫苗,1,cover hpv,,,
3057,queen 床 架子,1,queen,,,
3058,微 信号 lei,1,lei,,,
3059,求 一 张 全线 的 ride pass,1,ride pass,,,
3060,今年 waive 学校 的 requirement 有 没 有 遇到 问题,2,waive,requirement,,
3061,t family plan 的 holder,2,t family plan,holder,,
3062,现在 的 plan 是 无限 通话 和 短信,1,plan,,,
3063,可 share 路费,1,share,,,
3064,bus token 转让,1,bus token,,,
3065,由于 dickinson law 在 carlisle,2,dickinson law,carlisle,,
3066,如 有 同学 或 老师 正巧 在 carlisle 或者 有 认识 的 人 在 那里,1,carlisle,,,
3067,有意 的 请 联系 ding,1,ding,,,
3068,一 人 住 或 couple 住 都 相当 合适,1,couple,,,
3069,lease 是 到 明年 八月 的,1,lease,,,
3070,室内 有 full size 床,1,full size,,,
3071,并 提供 长途 ride,1,ride,,,
3072,一模一样 的 http,1,http,,,
3073,html 价格 暂定,1,html,,,
3074,美国 permit 也 已经 拿到 了,1,permit,,,
3075,驾照 permit 已经 拿到 了,1,permit,,,
3076,html 床头 sale,2,html,sale,,
3077,twin size 床 全 套,1,twin size,,,
3078,过 马路 是 giant,1,giant,,,
3079,但是 又 不 会 离 bus stop 太远,1,bus stop,,,
3080,求购 长期 bus pass,1,bus pass,,,
3081,地址 是 park crest terrace,1,park crest terrace,,,
3082,这个 变压器 就 是 step up,1,step up,,,
3083,pilot 黑 中性 笔 和 彩色 记号 笔 全新,1,pilot,,,
3084,printed enrollment 里 student id 都 是 错 的,2,printed enrollment,student id,,
3085,one 东西 都 在 vv,2,one,vv,,
3086,queen size 超 舒服 的 床,1,queen size,,,
3087,求 一 个 full size box,1,full size box,,,
3088,去年 开学 购 于 bed bath,1,bed bath,,,
3089,因 搬家 变成 full size 床 不 能 再 用,1,full size,,,
3090,因为 这 两 个 小区 的 床 是 queen size 的,1,queen size,,,
3091,memory foam 一般 价格 都 不 便宜,1,memory foam,,,
3092,房租 包括 bus pass 费用,1,bus pass,,,
3093,学生 一般 办 的 是 commuter parking,1,commuter parking,,,
3094,停车 的 位置 在 beaver stadium 那里,1,beaver stadium,,,
3095,你 可以 在 网上 买 http,1,http,,,
3096,bean edition 主要 配置 有,1,bean edition,,,
3097,html 最终 价格 可 商议 联系 电话,1,html,,,
3098,求 一 张 bus pass,1,bus pass,,,
3099,麻烦 发 msg 联系,1,msg,,,
3100,请 发 邮件 到 ernest,1,ernest,,,
3101,university park 校区,1,university park,,,
3102,或者 一起 找 ride,1,ride,,,
3103,giant 和 中国 超市,1,giant,,,
3104,均 为 full,1,full,,,
3105,giant 和 中国 超市,1,giant,,,
3106,均 为 full,1,full,,,
3107,tory burch 夏天 草编 凉鞋,1,tory burch,,,
3108,音效 简直 享受 绝对 是 提高 乘坐 质量 最 明显 的 package,1,package,,,
3109,车 的 所有 保养 全 在 mercedes benz state college,1,mercedes benz state college,,,
3110,放 个 google 相册 链接 吧,1,google,,,
3111,school bus 直接 开进 小区 里面,1,school bus,,,
3112,紧邻 high school,1,high school,,,
3113,ymca 等 运动 场所,1,ymca,,,
3114,school bus 直接 开进 小区 里面,1,school bus,,,
3115,ymca 等 运动 场所,1,ymca,,,
3116,我 是 michigan state university 毕业 的 美国人,1,michigan state university,,,
3117,现在 跟 mandarin consulting 公司 工作,1,mandarin consulting,,,
3118,corolla 车 耐用 可靠,1,corolla,,,
3119,自 驾 出游 能 提供 ride 的 吗,1,ride,,,
3120,tax 购入 现在 原价,1,tax,,,
3121,utility 不 包括,1,utility,,,
3122,包括 bus pass,1,bus pass,,,
3123,wahl 理发 套装,1,wahl,,,
3124,宜家 鸭绒 queen size 被 芯,1,queen size,,,
3125,别 太 狠 就 行 联系 email,1,email,,,
3126,twin 以上 大小 都 可以,1,twin,,,
3127,请 联系 cosmos,1,cosmos,,,
3128,提供 bus pass,1,bus pass,,,
3129,crossing 交通 非常 方便,1,crossing,,,
3130,不 开 party,1,party,,,
3131,坐标 university park,1,university park,,,
3132,不 开 party,1,party,,,
3133,有 没 有 park forest,1,park forest,,,
3134,有 人 在 美国 考 过 gre 吗,1,gre,,,
3135,房租 含 bus pass,1,bus pass,,,
3136,com 再 补充 一 点 信息,1,com,,,
3137,需要 和 我 share 厕所,1,share,,,
3138,作息 也 比较 规律 我 是 新 签 的 lease,1,lease,,,
3139,有 人 要 加入 family plan 吗,1,family plan,,,
3140,不 开 party,1,party,,,
3141,有 需要 的 同学 给 我 email,1,email,,,
3142,要 与 房东 签 lease,1,lease,,,
3143,请 email 我,1,email,,,
3144,分别 是 full size 和 twin size 的,2,full size,twin size,,
3145,图片 没有 拍 full size 的 图,1,full size,,,
3146,请 参考 twin size 的 图,1,twin size,,,
3147,college court 小区,1,college court,,,
3148,还有 一 年 的 warranty,1,warranty,,,
3149,在 pen state 短期 访问,1,pen state,,,
3150,edu 另 有 一 台 老式 电视,1,edu,,,
3151,还有 许多 碗 baking 盘,1,baking,,,
3152,请 参考 贴 子 http,1,http,,,
3153,如果 能 提供 ride,1,ride,,,
3154,lease 可以 过来 以后 再 签,1,lease,,,
3155,包 n v nv vn ve 几 条 线路 的 bus,2,n v nv vn ve,bus,,
3156,也 可 trade in 成 别的 班次,1,trade in,,,
3157,二 年级 phd,1,phd,,,
3158,完全 不 party,1,party,,,
3159,fan 实在 不 会 加 照片,1,fan,,,
3160,求 一 张 全线 的 ride pass 一年 半 年 都 可以 价格 可 议,1,ride pass,,,
3161,以及 bus pass,1,bus pass,,,
3162,有 bus 到 学校,1,bus,,,
3163,可以 提供 bus pass,1,bus pass,,,
3164,另外 希望 release 版权,1,release,,,
3165,twin size 床,1,twin size,,,
3166,便携 jump starter,1,jump starter,,,
3167,最近 帮 朋友 处理 moving sale 又 有 好多 东西 卖,1,moving sale,,,
3168,包含 bus pass 小区 地址,1,bus pass,,,
3169,com 每 日 都 有 往返 巴士 前往 纽约 唐人街,1,com,,,
3170,已 发送 加 好友 shen,1,shen,,,
3171,欢迎 各 大 社团 leader 联系 策划 活动 我们 有 最 专业 的 团队 以及 最 优惠 的 价格 联系 电话,1,leader,,,
3172,edu 家具 照片,1,edu,,,
3173,房子 为 apartment,1,apartment,,,
3174,有 房 出租 请 联系 king,1,king,,,
3175,以及 bus pass,1,bus pass,,,
3176,非常 的 nice,1,nice,,,
3177,edu 邮箱 无法 显示 中文,1,edu,,,
3178,tech 以下 说明 来自 百度,1,tech,,,
3179,html 质量 确实 很 好,1,html,,,
3180,有 兴趣 email,1,email,,,
3181,com 可 索要 照片,1,com,,,
3182,咖啡 机 gone,1,gone,,,
3183,很 适合 练 口语 the apartment already has three other guys rooming in it,1,the apartment already has three other guys rooming in it,,,
3184,详情 可以 email 联系,1,email,,,
3185,panda 洗衣机 有 图 吗,1,panda,,,
3186,需 和 房东 重新 签署 一 年 lease,1,lease,,,
3187,可以 包 bus 票,1,bus,,,
3188,twin size 的 床 一 张,1,twin size,,,
3189,html 联系 方式,1,html,,,
3190,target 和 ups,2,target,ups,,
3191,两 人 都 非常 nice,1,nice,,,
3192,com 我 可以 发 图片,1,com,,,
3193,说话 这么 mean,1,mean,,,
3194,至于 你 说 我 mean,1,mean,,,
3195,不 是 mean 是 什么,1,mean,,,
3196,物品 图片 见 google document,1,google document,,,
3197,打算 签 长期 的 lease,1,lease,,,
3198,com 我 会 尽快 回复,1,com,,,
3199,请 问 lease 从 什么 时候 开始,1,lease,,,
3200,有意 lease 请 问 房租 如何,1,lease,,,
3201,有 bus pass 吗,1,bus pass,,,
3202,也 祝 大家 找 房 shun,1,shun,,,
3203,yao 租房 的 欢迎 联系,1,yao,,,
3204,有 兴趣 可以 点击 http,1,http,,,
3205,my thai 等 餐馆,1,my thai,,,
3206,旁边 是 state high school,1,state high school,,,
3207,地理 系 现 招募 本校 学生 参与 一 个 与 vr 设备 相关 的 study,2,vr,study,,
3208,实验 地点 在 walker building,1,walker building,,,
3209,sign up 时 可 自主 选择 合适 的 参与 时间,1,sign up,,,
3210,edu 感激 不尽,1,edu,,,
3211,最 好在 pointe 附近,1,pointe,,,
3212,没有 公寓 或者 学校 住处 的 喧嚣 和 party,1,party,,,
3213,com 给 钱 就 买,1,com,,,
3214,state college 冬天 必备,1,state college,,,
3215,在 parkway plaza,1,parkway plaza,,,
3216,床 的 大小 最好 是 full size 及 以上,1,full size,,,
3217,park forest apartment 一 室 一 厅,1,park forest apartment,,,
3218,gate 两 室 一 厅 中 的 小 卧室 出租,1,gate,,,
3219,s gate 在 学校 南边,1,s gate,,,
3220,房租 和 户型 http,1,http,,,
3221,可以 考虑 提前 交 lease,1,lease,,,
3222,queen size 高档 木质 床,1,queen size,,,
3223,长期 提供 ride,1,ride,,,
3224,时间 我 会 在 此 update,1,update,,,
3225,co 提供 ride,2,co,ride,,
3226,sharing 物品 清单 和 简介,1,sharing,,,
3227,box 下 带 轮子,1,box,,,
3228,在 wayne 的 帮助 下 终于 如愿 拿到 了 驾照,1,wayne,,,
3229,然后 找到 了 wayne 做 陪练,1,wayne,,,
3230,wayne 教 车 耐心,1,wayne,,,
3231,wayne 看 我 技术 还 可以 所以 整个 教学 过程 很 紧凑,1,wayne,,,
3232,现有 twin size mattress,1,twin size mattress,,,
3233,许多 朋友 应该 知道 lion,1,lion,,,
3234,w cherry lane 两 室 一 厅 一 卫,1,w cherry lane,,,
3235,allen street 上 基本 没有 车,1,allen street,,,
3236,edu 这里 是 出租 卧室 的 video,2,edu,video,,
3237,这 是 floor plan,1,floor plan,,,
3238,希望 找到 可以 帮忙 kai che de ren,1,kai che de ren,,,
3239,一 年 的 utility fee,1,utility fee,,,
3240,可以 联系 email,1,email,,,
3241,com 或者 电话,1,com,,,
3242,几 家 不错 的 hotel,1,hotel,,,
3243,最近 复习 gre,1,gre,,,
3244,或者 求购 一 个 replacement 杯子,1,replacement,,,
3245,com 邮件 标明,1,com,,,
3246,com 邮件 标明,1,com,,,
3247,最好 包 bus pass 要求,1,bus pass,,,
3248,人 很 nice,1,nice,,,
3249,但 一直 放 在 guest room,1,guest room,,,
3250,如有 需要 请 尽快 email 我,1,email,,,
3251,最好 是 在 heights,1,heights,,,
3252,我 在 park crest 有 合适 的 房间,1,park crest,,,
3253,有 heights 的 吗,1,heights,,,
3254,现 紧急 出租 lion crossing 四 人间 卧室 一 间,1,lion crossing,,,
3255,人 很 nice 爱 干净,1,nice,,,
3256,电气 费 由 office 每 月 结算 后,1,office,,,
3257,hello 请 问 房间 还 有 吗,1,hello,,,
3258,pilot 黑 中性 笔 和 彩色 记号 笔,1,pilot,,,
3259,每 年 都 有 定期 car inspection,1,car inspection,,,
3260,距 学校 bus 十 分钟,1,bus,,,
3261,up up up 呀,1,up up up,,,
3262,hello 请 问 房间 还 有 吗,1,hello,,,
3263,大家 都 在 哪里 做 的 car inspection,1,car inspection,,,
3264,有 推荐 比较 靠 谱 的 地方 吗 另外 joel confer 有 去 过 的 吗,1,joel confer,,,
3265,s crossing 搬 出来,1,s crossing,,,
3266,距离 penn state 大学 和 小学,1,penn state,,,
3267,可以 email 联系 吗,1,email,,,
3268,过 马路 是 giant,1,giant,,,
3269,时间 较 flexible,1,flexible,,,
3270,gate 两 室 一 厅 中 的 小 卧室 出租,1,gate,,,
3271,s gate 在 学校 南边,1,s gate,,,
3272,不 吵闹 开 party,1,party,,,
3273,人 非常 nice,1,nice,,,
3274,时间 可以 flexible,1,flexible,,,
3275,由于 park crest 审核 比较 严格,1,park crest,,,
3276,可以 一起 签 lease,1,lease,,,
3277,park crest 离 东方 超市 以及 giant 都 非常 近,2,park crest,giant,,
3278,park crest 小区,1,park crest,,,
3279,在 state college 内 就 好,1,state college,,,
3280,我 在 heights 的 lease 结束,2,heights,lease,,
3281,免除 初 到 纽约 到处 找 transient 买 卡 的 麻烦,1,transient,,,
3282,请 问 lion crossing 考虑 吗,1,lion crossing,,,
3283,只好 用到 google drive 了,1,google drive,,,
3284,park crest 是 村里 性价比 比较 高 的 小区,1,park crest,,,
3285,我 的 lease 到 七月 底 结束,1,lease,,,
3286,挺 想 搬到 park crest 的,1,park crest,,,
3287,听说 park crest 有 收入 限制,1,park crest,,,
3288,最近 两 三 天 有 人 去 纽约 jfk 机场 吗,1,jfk,,,
3289,请 看 更新 的 list,1,list,,,
3290,希望 房子 距离 ist 和 超市 不要 太远,1,ist,,,
3291,我 现 住 的 一 间 apartment,1,apartment,,,
3292,位于 parkway plaza,1,parkway plaza,,,
3293,living room 和 bedroom 的 面积 基本 一 样 大,2,living room,bedroom,,
3294,合同 与 rental office 签,1,rental office,,,
3295,需要 ride 的 赶紧 联系 我,1,ride,,,
3296,需要 ride 的 赶紧 联系 我 哈,1,ride,,,
3297,住 park forest apartments,1,park forest apartments,,,
3298,提供 ride 到 华盛顿,1,ride,,,
3299,车 购 自 dealer,1,dealer,,,
3300,见 下面 amazon 的 链接,1,amazon,,,
3301,full size bed 很 新,1,full size bed,,,
3302,非常 适合 couple 使用,1,couple,,,
3303,我们 是 couple,1,couple,,,
3304,请 问 有 没 有 同学 对 finance,1,finance,,,
3305,com 谢谢 啦,1,com,,,
3306,如果 你 对 stock trading 感 兴趣,1,stock trading,,,
3307,上面 有 很多 牛 人 有 ditto trade 的 账户,1,ditto trade,,,
3308,你 可以 跟着 他们 进行 trading,1,trading,,,
3309,web 我 有些 生活 用品 要 卖,1,web,,,
3310,park crest 小区,1,park crest,,,
3311,所有 电器 都 是 functional 的,1,functional,,,
3312,已 更新 gone 的 和 预定 的 都 用 颜色 标记 了 欢迎 购买 和 咨询,1,gone,,,
3313,刚刚 更新 了 post,1,post,,,
3314,新 添 了 两 个 item,1,item,,,
3315,可以 跟 我 email 联系 哦,1,email,,,
3316,需要 ride 的 请 联系,1,ride,,,
3317,可 email 我,1,email,,,
3318,asian friendly 地址,1,asian friendly,,,
3319,本人 huck institute of life science 的 学生,1,huck institute of life science,,,
3320,专业 是 biotechnology,1,biotechnology,,,
3321,本人 是 penn state 刚刚 毕业 学生,1,penn state,,,
3322,drinks 可 免费 享用 club 里面 的 免费 小吃 和 饮料,2,drinks,club,,
3323,包括 beer wine etc,1,beer wine etc,,,
3324,一些 club 可 提供 bathroom and shower,2,club,bathroom and shower,,
3325,可以 share 邮费 和 部分 辛苦 费,1,share,,,
3326,我 可以 给 ride,1,ride,,,
3327,本人 master 男,1,master,,,
3328,park crest 交通 非常 方便,1,park crest,,,
3329,距离 giant 超市 和 中国 超市 都 很 近,1,giant,,,
3330,family plan 基本 情况,1,family plan,,,
3331,那 一 家 公寓 确实 在 illinois,1,illinois,,,
3332,sharing 如 有 兴趣,1,sharing,,,
3333,可 提供 往返 或 单程 的 ride,1,ride,,,
3334,去 哪 zhao,1,zhao,,,
3335,均 为 penn state 的 访问 学者,1,penn state,,,
3336,请 联系 微 信 chen,1,chen,,,
3337,没有 公寓 或者 学校 住处 的 喧嚣 和 party,1,party,,,
3338,想 购入 gps,1,gps,,,
3339,可 自行 google map 位置,1,google map,,,
3340,也 可 乘 bus,1,bus,,,
3341,步行 三 分钟 到 cvs 超市,1,cvs,,,
3342,两 层 house 上下 各 有 一 间 卫生间,1,house,,,
3343,欲 购 从速 哦 请 联系 tian,1,tian,,,
3344,感兴趣 请 联系 tian,1,tian,,,
3345,要 在 bus 路线 上,1,bus,,,
3346,imperial tower 是 state college 公认 性价比 最高 的 公寓,2,imperial tower,state college,,
3347,附近 有 fuji,1,fuji,,,
3348,本人 是 penn state 交流 博士,1,penn state,,,
3349,两 年 前 在 mattress world 购入,1,mattress world,,,
3350,具体 物品 和 价格 可以 参看 google drive 里面 的 图片 链接,1,google drive,,,
3351,牌子 为 zoom,1,zoom,,,
3352,com 第一 波,1,com,,,
3353,woodbury 好 远 啊,1,woodbury,,,
3354,免除 初 到 纽约 到处 找 transient 买 卡 的 麻烦,1,transient,,,
3355,回国 前 打算 去 趟 周边 城市 的 outlet,1,outlet,,,
3356,可 提供 ride,1,ride,,,
3357,up up up 房子 还 在 哈,1,up up up,,,
3358,小区 有 很多 中国 的 family,1,family,,,
3359,本人 因 工作 原因 即将 离开 state college,1,state college,,,
3360,kelsey 联系 方式,1,kelsey,,,
3361,只 要是 penn state 职员 学生 学者,1,penn state,,,
3362,免费 cable 和 internet,2,cable,internet,,
3363,refer 真 不 管用,1,refer,,,
3364,只是 善意 提醒 不要 浪费 了 hard pull,1,hard pull,,,
3365,需要 与 另 一 次 卧 share 卫生间,1,share,,,
3366,因为 比较 难 找到 人 接 你 的 lease,1,lease,,,
3367,小区 包 bus pass,1,bus pass,,,
3368,nv 和 vn 线,2,nv,vn,,
3369,原 pheasant glen,1,pheasant glen,,,
3370,utilities 全 包,1,utilities,,,
3371,prefer 短信 先,1,prefer,,,
3372,租金 和 utilities 怎么 算 的 呢,1,utilities,,,
3373,提供 bus pass,1,bus pass,,,
3374,crossing 交通 非常 方便,1,crossing,,,
3375,不 开 party,1,party,,,
3376,siena woods 是 三 室 四 卫 的 房型 结构,1,siena woods,,,
3377,siena woods 非常 安静,1,siena woods,,,
3378,edu 房租 好 说,1,edu,,,
3379,clean automatic hot soy milk maker 用 的 次数 很 少,1,clean automatic hot soy milk maker,,,
3380,所以 这个 size 的 床 比较 适合 睡觉 老实,1,size,,,
3381,坐标 是 南边 的 lion,1,lion,,,
3382,sofa bed 原价,1,sofa bed,,,
3383,gate 两 室 一 厅 中 的 小 卧室 出租,1,gate,,,
3384,s gate 在 学校 南边,1,s gate,,,
3385,com 小区 官 网 http,2,com,http,,
3386,大家 好 我 是 ie master 女生,1,ie master,,,
3387,长期 提供 penn state to ny or other state 长途 接送,1,penn state to ny or other state,,,
3388,如果 感 兴趣 请 text 我,1,text,,,
3389,一 个 fireplace 和 一 个 露台,1,fireplace,,,
3390,租车 费用 share,1,share,,,
3391,浴缸 和 closet,1,closet,,,
3392,queen size 床,1,queen size,,,
3393,房屋 全 furnished,1,furnished,,,
3394,giant 和 中国 超市,1,giant,,,
3395,马上 三月 初 就 要 study abroad 去 德国 交换 一 学期,1,study abroad,,,
3396,门口 驱车 一百 米 就 是 sheet,1,sheet,,,
3397,一 件 half bathroom,1,half bathroom,,,
3398,二 楼 的 是 full bathroom,1,full bathroom,,,
3399,不 在家 开 party,1,party,,,
3400,lions crossing 地址,1,lions crossing,,,
3401,leases 是 和 小区 新 签 欢迎 联系,1,leases,,,
3402,非常 的 nice,1,nice,,,
3403,com 第一 波,1,com,,,
3404,有 兴趣 请 联系 邮箱 lee,1,lee,,,
3405,过 马路 是 giant,1,giant,,,
3406,求 回 村 ride,1,ride,,,
3407,但 还是 求 一下 ride 吧,1,ride,,,
3408,可以 提供 ride,1,ride,,,
3409,如果 有 去 的 ride 也 可以 的,1,ride,,,
3410,前 几 天 刚 做 过 inspection,1,inspection,,,
3411,sharing 具体 价格 可以 详细 商量,1,sharing,,,
3412,com 住 vv,2,com,vv,,
3413,上 周 amazon 上 新 的 aroma 火锅 才,2,amazon,aroma,,
3414,utility 全 包,1,utility,,,
3415,餐馆 有 fuji,1,fuji,,,
3416,本人 感觉 性价比 hen,1,hen,,,
3417,地处 wells terrace,1,wells terrace,,,
3418,独 栋 house 中 的 一 间,1,house,,,
3419,需要 和 另外 一 个 住户 share 二 楼 的 卫生间 浴室,1,share,,,
3420,但 地下室 有 一 个 full bath 可以 使用,1,full bath,,,
3421,可 续签 下 学年 lease,1,lease,,,
3422,新 签 lease,1,lease,,,
3423,虽然 也 是 新 签 lease,1,lease,,,
3424,如果 满意 可以 与 office 签约 下 一 年 的 lease 联系 方式,2,office,lease,,
3425,邻居 也 不 会 很 闹 开 party 啥 的,1,party,,,
3426,转让 meal plan 十 次 午餐 卡,1,meal plan,,,
3427,部分 物品 的 图片 放在 这里 http,1,http,,,
3428,二 层 是 两 个 bedroom,1,bedroom,,,
3429,share 一 个 full bathroom,2,share,full bathroom,,
3430,但 prefer 男生,1,prefer,,,
3431,也 有用 queen size 床 的,1,queen size,,,
3432,有意 一 年 lease,1,lease,,,
3433,并且 需要 约 房东 更新 lease,1,lease,,,
3434,我们 想 是 三 个 人 的 名字 最后 都 要 在 lease 上面,1,lease,,,
3435,full size 床,1,full size,,,
3436,com 第一 波,1,com,,,
3437,park forest 小区,1,park forest,,,
3438,共同 签 lease,1,lease,,,
3439,可以 drop 掉,1,drop,,,
3440,在 这里 推荐 一 个 google chrome 的 插件 叫 rate my penn state,2,google chrome,rate my penn state,,
3441,用 google chrome 的 同学 千万 不 要 错过 哦,1,google chrome,,,
3442,去 google 的 web store 搜索 rate my penn state 并 添加 app 就 可以 了,4,google,web store,rate my penn state,app,
3443,需要 投 quarter,1,quarter,,,
3444,想 找 studio,1,studio,,,
3445,或者 单独 的 studio,1,studio,,,
3446,park forest 房子 出租,1,park forest,,,
3447,两 个 安静 的 phd,1,phd,,,
3448,签 一 年 lease,1,lease,,,
3449,不 常 开 party,1,party,,,
3450,本人 phd 新生,1,phd,,,
3451,是 新 的 lease,1,lease,,,
3452,用 visa 卡 就 行,1,visa,,,
3453,我 记得 是 一 个 pdf 文档,1,pdf,,,
3454,home 打开 网页 以后,1,home,,,
3455,htm 打开 网页 之后,1,htm,,,
3456,在 state college 的 ups 商店 就 可以 采集 指纹,2,state college,ups,,
3457,你 到 了 以后 就 直接 去 ups 把 指纹 给 采集 了,1,ups,,,
3458,具体 细节 参考 http,1,http,,,
3459,blender 已 出,1,blender,,,
3460,距离 penn state 大学 和 小学,1,penn state,,,
3461,暑假 office 好像 有 在 搞活 动,1,office,,,
3462,如 题 tel,1,tel,,,
3463,如 题 tel,1,tel,,,
3464,地点 离 park forest 越 近 越 好,1,park forest,,,
3465,出 modem 一 个,1,modem,,,
3466,桌子 链接 http,1,http,,,
3467,开 party 的 同学 看 过来 啦,1,party,,,
3468,车 在 park crest,1,park crest,,,
3469,过 马路 是 giant,1,giant,,,
3470,只是 个人 原因 不得不 放弃 heights 的 房间,1,heights,,,
3471,如 有意 请 email,1,email,,,
3472,本人 在 cooper beech 有 两 个 房间 可 供 出租,1,cooper beech,,,
3473,房子 为 房东 的 私人 house,1,house,,,
3474,包 所有 utility,1,utility,,,
3475,现在 去 了 uc davis,1,uc davis,,,
3476,请 直接 联系 房东 joe sullivan,1,joe sullivan,,,
3477,haul truck size 大小 的 车 帮忙 搬家,1,haul truck size,,,
3478,包括 mental frame,1,mental frame,,,
3479,pizza hut 街 对面,1,pizza hut,,,
