SentenceID,CodeSwitchedSentence,NumberOfCodeSwitching,CodeSwitch1,CodeSwitch2,CodeSwitch3,CodeSwitch4
3976,这么 好 的 deal 去 哪里 找,1,deal,,,
3977,每 两 人 共用 一 bathroom 联系 方式,1,bathroom,,,
3978,park crest 交通 非常 方便,1,park crest,,,
3979,距离 giant 超市 和 中国 超市 都 很 近,1,giant,,,
3980,你 需要 的 所有 超市 都 在 bus 线上,1,bus,,,
3981,两 个 full bathroom,1,full bathroom,,,
3982,两 个 living room,1,living room,,,
3983,com 李 同学 电话,1,com,,,
3984,com 发 邮件 时 请 注明 租房,1,com,,,
3985,有 需要 ride 可以 联系 我,1,ride,,,
3986,本人 为 penn state 在 读 博士生,1,penn state,,,
3987,包括 bus pass,1,bus pass,,,
3988,从不 在 家里 开 party,1,party,,,
3989,ve 和 nv,2,ve,nv,,
3990,步行 trail 小路,1,trail,,,
3991,staples 购物 区 和 red lobster 餐厅,2,staples,red lobster,,
3992,sharing 联系 方式,1,sharing,,,
3993,以及 其他 laredo 标准 配置,1,laredo,,,
3994,我 可以 给 你 sticker parking,1,sticker parking,,,
3995,ve 和 nv,2,ve,nv,,
3996,步行 trail 小路,1,trail,,,
3997,staples 购物 区 和 red lobster 餐厅,2,staples,red lobster,,
3998,都 非常 安静 nice,1,nice,,,
3999,房间 仍然 available,1,available,,,
4000,整个 state college 性价比 最高 的 小区,1,state college,,,
4001,价格 比 uber 公道,1,uber,,,
4002,现在 的 apt 被 其他 三 个 人 接 了 lease,2,apt,lease,,
4003,比 credit card 便宜,1,credit card,,,
4004,远离 喧嚣 的 atherton st,1,atherton st,,,
4005,日 常 utility 开销,1,utility,,,
4006,房屋 内 日常 utility 为 水,1,utility,,,
4007,各 项 utility 约为,1,utility,,,
4008,oil tank 位 于 房子 地下室,1,oil tank,,,
4009,d 和 master,2,d,master,,
4010,距离 campus 非常 近,1,campus,,,
4011,park hill apartment 家具 齐全,1,park hill apartment,,,
4012,提供 bus pass,1,bus pass,,,
4013,没有 开 party 的 习惯,1,party,,,
4014,求 包车 去 jfk 机场,1,jfk,,,
4015,woods edge 小区,1,woods edge,,,
4016,离 trader joe,1,trader joe,,,
4017,物业 和 sewage,1,sewage,,,
4018,com 微 信号,1,com,,,
4019,有 同行 或 需要 ride 的 可以 一起,1,ride,,,
4020,无线 路由器 是 cable modem 么,1,cable modem,,,
4021,房子 在 long meadow lane,1,long meadow lane,,,
4022,sunset park 后面,1,sunset park,,,
4023,可以 从 sunset park 直接 穿 过去 学校,1,sunset park,,,
4024,还有 giant 都 不 远,1,giant,,,
4025,utility 不 包,1,utility,,,
4026,还 附 bus pass,1,bus pass,,,
4027,最近 老 有 dealer 打 电话 要 收,1,dealer,,,
4028,草坪 护理 gas,1,gas,,,
4029,本人 第二 年 phd 女生,1,phd,,,
4030,房屋 lease 八月 中旬 开始,1,lease,,,
4031,所以 在 这里 求 一下 ride,1,ride,,,
4032,我 send 邀请 给 你们,1,send,,,
4033,小区 门口 有 v ve vn nv 可以 坐,1,v ve vn nv,,,
4034,net 在 村 里 的 也 可以 过来 参观,1,net,,,
4035,可以 google 一下,1,google,,,
4036,是 直接 跟 office 签 lease,2,office,lease,,
4037,tv cable 等等,1,tv cable,,,
4038,office 人 也 很 nice,2,office,nice,,
4039,我 是 phd 第二 年,1,phd,,,
4040,安静 但 不 boring,1,boring,,,
4041,安静 又 爱 干净 的 grad student,1,grad student,,,
4042,clubhouse 有 温泉,1,clubhouse,,,
4043,门口 有 专人 收 垃圾 state college 最 好 的 小区,1,state college,,,
4044,只 提供 从 jfk 走 的,1,jfk,,,
4045,fuji 中 餐馆,1,fuji,,,
4046,小区 门口 有 v ve vn nv 可以 坐,1,v ve vn nv,,,
4047,本人 二 年级 phd 女,1,phd,,,
4048,不 party 的 美国 女生,1,party,,,
4049,和 bus pass,1,bus pass,,,
4050,本人 是 penn state 在 读 博士,1,penn state,,,
4051,不 开 party,1,party,,,
4052,楼 主 是 一 个 在 heights 住 过 半 年 的 住户,1,heights,,,
4053,首先 就说 签 lease 的 时候,1,lease,,,
4054,楼 主 我 后来 才 了解 到 其他 大部分 小区 收 的 都 是 deposit,1,deposit,,,
4055,heights 还是 要 先 收 你 一 整 个 月 的 房租,1,heights,,,
4056,heights 你 过来 一下,1,heights,,,
4057,我 一 进 卫生间 整个 block 都 知道 我 在 上 厕所,1,block,,,
4058,heights 不 是 一向 以 高端 小区 自居 吗,1,heights,,,
4059,因为 楼主 的 车 在 final week 被 拖 了 三 次,1,final week,,,
4060,在 final week 被 拖 了 三 次,1,final week,,,
4061,当时 heights 不 上班,1,heights,,,
4062,因为 你 没 停 到 heights 指定 的 小区,1,heights,,,
4063,heights 可以 强行 出入 任何 人 的 任何 一 个 房间,1,heights,,,
4064,最近 让 我们 交 所谓 的 damage fee,1,damage fee,,,
4065,我们 去 office 要 check list,2,office,check list,,
4066,建议 求助 学校 免费 的 student legal service,1,student legal service,,,
4067,我 本来 以为 copper beech 是 最 恶心 的 后来 发现 学校 周边 的 小区 都 差不多,1,copper beech,,,
4068,而且 有 非常 多 的 visitor parking 位,1,visitor parking,,,
4069,楼 主 如果 没有 办 permit 为什么 不 停 visitor parking 呢,2,permit,visitor parking,,
4070,没有 permit 被 拖 不 是 很 正常 吗,1,permit,,,
4071,west aaron drive 房子 在 一楼,1,west aaron drive,,,
4072,小区 位 于 state college 北部,1,state college,,,
4073,门口 公交 线路 有 n ne nv,1,n ne nv,,,
4074,往返 学校 和 downtown 都 很 方便,1,downtown,,,
4075,officer 人 很 好,1,officer,,,
4076,附近 有 giant,1,giant,,,
4077,edu 发 图片 谢谢,1,edu,,,
4078,当时 初 来 penn state 不 适应,1,penn state,,,
4079,我 转 lease 之后,1,lease,,,
4080,直接 renew 我 的 lease 即可,2,renew,lease,,
4081,两 两 share,1,share,,,
4082,公交 卡 cover 线路,1,cover,,,
4083,若 有 人 担心 厕所 要 share,1,share,,,
4084,小区 位 于 state college 北部,1,state college,,,
4085,nv 和 vn 线,2,nv,vn,,
4086,方便 到达 学校 和 downtown,1,downtown,,,
4087,无需 security deposit,1,security deposit,,,
4088,三 厢 sedan,1,sedan,,,
4089,此 车 原 为 state college 的 老师 家用,1,state college,,,
4090,如果 你 在 state college 生活,1,state college,,,
4091,按照 good condition,1,good condition,,,
4092,最后 三 个 月 department store,1,department store,,,
4093,完全 适合 黑 五 圣诞 的 outlet 血 拼,1,outlet,,,
4094,每人 可以 拥有 两 张 discover 卡,1,discover,,,
4095,但 由于 最近 的 double cash back,1,double cash back,,,
4096,满 一 年 再 申 chase,1,chase,,,
4097,master 卡 高 很多,1,master,,,
4098,discover 对 新 用户 很 友好,1,discover,,,
4099,或 bank letter,1,bank letter,,,
4100,需要 签 一 年 lease,1,lease,,,
4101,应该 是 state college 最 便宜 的 了,1,state college,,,
4102,我们 也是 接 以前 的 lease,1,lease,,,
4103,不 开 party,1,party,,,
4104,潜在 fail 的 point,2,fail,point,,
4105,暑假 短 租 park forest 两 室 一 厅,1,park forest,,,
4106,两 个 卧室 都 有 full size 的 床,1,full size,,,
4107,office 非常 友好,1,office,,,
4108,本人 在 pittsburgh 机场 附近,1,pittsburgh,,,
4109,不 常 开 party,1,party,,,
4110,如果 只 想 从 august 开始 租 也 可以 的,1,august,,,
4111,nv 和 vn 均 有,2,nv,vn,,
4112,因为 新 的 lease 还 未 签订,1,lease,,,
4113,物业 也 很 nice,1,nice,,,
4114,one bed room 那种,1,one bed room,,,
4115,附近 有 weise 超市,1,weise,,,
4116,gap 和 burt,2,gap,burt,,
4117,s bee 的 居多,1,s bee,,,
4118,顺便 gym 跑步 的 distance 的 单位 是 公里 还 是 迈,2,gym,distance,,
4119,是 绕 vv 后面 和 copper beach,2,vv,copper beach,,
4120,gym 算 mile,2,gym,mile,,
4121,想 求 att 的 family plan 的 一 个 名额,2,att,family plan,,
4122,如果 prefer 走路,1,prefer,,,
4123,moving sale 结束,1,moving sale,,,
4124,park forest 房子 出租,1,park forest,,,
4125,两 个 安静 的 phd 男生,1,phd,,,
4126,一 年 里 所有 的 保养 都 是 按时 在 dealer 那 做 的,1,dealer,,,
4127,地址 是 park forest ave 的 一 个 小区,1,park forest ave,,,
4128,我 是 一 个 phd 第二 年,1,phd,,,
4129,另 一 个 是 离 trader joe 很 近,1,trader joe,,,
4130,j max 衣服 店,1,j max,,,
4131,edu 熊 先生,1,edu,,,
4132,住 park forest apartment,1,park forest apartment,,,
4133,昨天 收到 通知 说明 后天 会 有 inspection,1,inspection,,,
4134,适合 朋友 一起 租 上 summer,1,summer,,,
4135,full size 床,1,full size,,,
4136,两 人 share 一 个 卫生间,1,share,,,
4137,com 手机 号码,1,com,,,
4138,黑色 sunbeam 电 风扇,1,sunbeam,,,
4139,ck secret obsession 香水,1,ck secret obsession,,,
4140,gre og 第二 版 带 光盘,1,gre og,,,
4141,nine west 凉鞋,1,nine west,,,
4142,送 同 牌子 full size lip balm,1,full size lip balm,,,
4143,lipstick 大 红色,1,lipstick,,,
4144,两 人 share 卫浴,1,share,,,
4145,最 关键 的 是 小区 提供 bus,1,bus,,,
4146,edu 可 联系 进一步 索要 房间 照片 欢迎 联系,1,edu,,,
4147,当年 也 是 早早 就 去 签 lease 才 有 比较 好 的 位置,1,lease,,,
4148,本人 女 ee master 还有 一 年 毕业,1,ee master,,,
4149,顶 nan 姐,1,nan,,,
4150,这 是 链接 http,1,http,,,
4151,一 年 前 从 dealer 买 的,1,dealer,,,
4152,和 link 中 这 款 类似,1,link,,,
4153,无 公司 logo,1,logo,,,
4154,需要 share bathroom,1,share bathroom,,,
4155,living room 提供 液晶 电视,1,living room,,,
4156,mall 和 很多 专卖 店 和 吃饭 的 地方,1,mall,,,
4157,遇到 节假日 物业 有时 会 开 party,1,party,,,
4158,有 紧急 情况 随时 call 物业,1,call,,,
4159,网 费 等 free,1,free,,,
4160,路过 学校 主要 的 地方 如 downtown 等,1,downtown,,,
4161,bus 几乎 都 有 座位,1,bus,,,
4162,bus 一般 都 比较 准时 到达,1,bus,,,
4163,网站 在 这 http,1,http,,,
4164,blue knob 要 开 一 个 小时 的 车,1,blue knob,,,
4165,这里 的 房子 很 抢手 waiting list 很 长,1,waiting list,,,
4166,暖气 用 gas 交通,1,gas,,,
4167,miami heat 时间,1,miami heat,,,
4168,po 主 刚 拿到 教育 学院 的 learning,2,po,learning,,
4169,technology 项目 的 博士 录取,1,technology,,,
4170,funding 什么 的 还没 和 教授 谈,1,funding,,,
4171,我 大概 一 两 个 星期 之后 会 去 university park 和 教授 沟通 下,1,university park,,,
4172,欢迎 电话 或者 email 咨询,1,email,,,
4173,有 需要 去 芝加哥 的 我 可以 提供 ride,1,ride,,,
4174,到 des moines 要 开 几 天 啊,1,des moines,,,
4175,calculator 请 联系,1,calculator,,,
4176,除 房租 外 没有 其他 费用 furnished,1,furnished,,,
4177,有 没 有 正好 从 boston 回到 村里 的 同路人,1,boston,,,
4178,but work best with windows 附 mac 链接 线,2,but work best with windows,mac,,
4179,有 问题 反映 给 office,1,office,,,
4180,我 是 让 你 和 office 重新 签约,1,office,,,
4181,然后 你 不用 跟 office 签约,1,office,,,
4182,所有 租金 等 费用 都 在 office 规定 范围 内,1,office,,,
4183,地点 在 villas at happy valley,1,villas at happy valley,,,
4184,s club 的 后面,1,s club,,,
4185,就是 mall 那里,1,mall,,,
4186,office 的 club 非常 好 经常 有 活动,2,office,club,,
4187,也 可以 单独 租 一 个 bedroom,1,bedroom,,,
4188,感兴趣 的 同学 请 email 我,1,email,,,
4189,com 或是 text 我,2,com,text,,
4190,帮 我 的 lab 同学 转发 的,1,lab,,,
4191,详情 请 见 http,1,http,,,
4192,可 transfer name,1,transfer name,,,
4193,hershey 巧克力 工厂 等,1,hershey,,,
4194,delaware 免 税 州,1,delaware,,,
4195,utility 中 包 水,1,utility,,,
4196,my thai 等等,1,my thai,,,
4197,guest parking 也 是 免费,1,guest parking,,,
4198,现在 的 lease 到 七月 底,1,lease,,,
4199,发 短信 请 注明 买 汽车 保险 本人 代理 nationwide,1,nationwide,,,
4200,progressive 等 大 公司 保险,1,progressive,,,
4201,是 state college 北面 的 大型 公寓 型 小区,1,state college,,,
4202,nv 和 vn 线,2,nv,vn,,
4203,押金 和 lease 问题 面谈,1,lease,,,
4204,地址 在 park crest,1,park crest,,,
4205,经常 会 有 免费 的 fitness class,1,fitness class,,,
4206,办公室 就 在家 旁边 的 clubhouse 里,1,clubhouse,,,
4207,门 口 有 bus,1,bus,,,
4208,离 主要 grocery shopping 近,1,grocery shopping,,,
4209,有 w we nv n ne 等 线路 经过,1,w we nv n ne,,,
4210,请 问 lease 到 几 月,1,lease,,,
4211,还有 没 有 其他 公司 便宜 的 insurance plan,1,insurance plan,,,
4212,但 学校 也 approved 的 那 种,1,approved,,,
4213,sm 或者 iso,2,sm,iso,,
4214,之前 看到 有 贴 大家 说 state id 就 可以 是 penn state id 吗,2,state id,penn state id,,
4215,permit 预约 学校 体检 排队 死 人 了,1,permit,,,
4216,title 真 假 不 用 你 操心,1,title,,,
4217,和 对方 一起 去 过户 当场 就能 拿到 属于 你 的 新 title,1,title,,,
4218,penn state id 不 行 的,1,penn state id,,,
4219,有 driver license 就 不 要 了,1,driver license,,,
4220,之后 邮寄 正式 title,1,title,,,
4221,记得 车 要 以 最好 是 gift 或者 尽量 少 点 金额 上报 给 officer,2,gift,officer,,
4222,此 人 发 邮件 给 我 各 种 说 需要 求 ride,1,ride,,,
4223,此 人 问 我 ride 后 我 告诉 他 现在 不 方便 提供 车,1,ride,,,
4224,jfk 附近 可以 中途 放下 短信 联系,1,jfk,,,
4225,off 男士 烫发 现价,1,off,,,
4226,就 在 downtown,1,downtown,,,
4227,clubhouse 有 温泉,1,clubhouse,,,
4228,可以 算 state college 最 好 的 小区,1,state college,,,
4229,parkway plaza 一 室 一 厅 一 卫,1,parkway plaza,,,
4230,可以 随时 与 office 续签,1,office,,,
4231,药店 rite aid,1,rite aid,,,
4232,good will 和 pete,2,good will,pete,,
4233,求购 吸尘器 最好 新 一 点 sherry,1,sherry,,,
4234,一般 大 城市 的 chinatown 都 会有,1,chinatown,,,
4235,一 年 里 所有 的 保养 都 是 按时 在 dealer 那 做 的,1,dealer,,,
4236,提供 bus pass,1,bus pass,,,
4237,无需 security deposit,1,security deposit,,,
4238,是 state college 北面 的 大型 公寓 型 小区,1,state college,,,
4239,nv 和 vn 线,2,nv,vn,,
4240,off 男士 烫发 现价,1,off,,,
4241,就 在 downtown,1,downtown,,,
4242,sz styling 啊,1,sz styling,,,
4243,另外 两 个 房间 是 share 洗手间,1,share,,,
4244,是 三 个 人 一起 share 的,1,share,,,
4245,gas 费用 要 自己 付,1,gas,,,
4246,所有 日常 保养 全 是 在 honda dealer 做 的,1,honda dealer,,,
4247,刚 换 的 transmission oil,1,transmission oil,,,
4248,类似 的 mileage 在 blue knob 卖,2,mileage,blue knob,,
4249,然后 我 会 告知 vin,1,vin,,,
4250,ebay 上 二 手 卖,1,ebay,,,
4251,rp 或者 rc,2,rp,rc,,
4252,我 免费 借 ride for five 给 你 使用,1,ride for five,,,
4253,离 南边 著名 的 fuji,1,fuji,,,
4254,html 如 有 兴趣,1,html,,,
4255,com 就 有 机会 成为 我们 核心 成员 一 枚 拉,1,com,,,
4256,还有 ride 吗,1,ride,,,
4257,由于 另外 一 个 roommate 的 家 在 dc,2,roommate,dc,,
4258,附 一 个 免费 车位 imperial towers 是 村里 口碑 最 好 的 小区,1,imperial towers,,,
4259,房东 超级 nice,1,nice,,,
4260,适合 研究生 couple 或 访问 学者,1,couple,,,
4261,现 有 east cherry lane house 一 个 卧室 出租,1,east cherry lane house,,,
4262,还 附 bus pass,1,bus pass,,,
4263,出租 parkway plaza 两 室 一 厅,1,parkway plaza,,,
4264,mandarin consulting 的 品牌 项目,1,mandarin consulting,,,
4265,clubhouse 有 温泉,1,clubhouse,,,
4266,可以 算 state college 最 好 的 小区,1,state college,,,
4267,heater 已 出,1,heater,,,
4268,还 附 bus pass,1,bus pass,,,
4269,park crest 是 最 具 性价比,1,park crest,,,
4270,只要 有 state id 就 可以,1,state id,,,
4271,任何 dealer 那儿 都 可以,1,dealer,,,
4272,如果 不 是 dealer 呢,1,dealer,,,
4273,有 state id 就 可以,1,state id,,,
4274,fuji garden 等等 餐厅,1,fuji garden,,,
4275,五 分钟 走到 fuji,1,fuji,,,
4276,求 一 女生 同 签 executive,1,executive,,,
4277,roommate 是 个 安静 的 中国 女生,1,roommate,,,
4278,clubhouse 有 温泉,1,clubhouse,,,
4279,可以 算 state college 最 好 的 小区,1,state college,,,
4280,水 网络 和 cable,1,cable,,,
4281,租 的 话 楼 主 可以 送 个 bus pass,1,bus pass,,,
4282,三 个 人 share,1,share,,,
4283,park crest 官 网上 写 着,1,park crest,,,
4284,com 貌似 你 不 是 本校 的 吧,1,com,,,
4285,牌子 是 sonya 的,1,sonya,,,
4286,因为 正好 在 居住 人 比较 多 的 the pointe 前 一 站,1,the pointe,,,
4287,需要 ride 请 联系,1,ride,,,
4288,parkway plaza 校区,1,parkway plaza,,,
4289,为人 超级 nice,1,nice,,,
4290,门 口 有 bus,1,bus,,,
4291,离 主要 grocery shopping 近,1,grocery shopping,,,
4292,此 小区 是 state college 信 价 比 最 高 的 小区,1,state college,,,
4293,过 马路 是 giant,1,giant,,,
4294,现在 已 住 两 位 phd,1,phd,,,
4295,如 有 意向 联系 sat,1,sat,,,
4296,该 小区 有 全 state college 最好 小区 之 称,1,state college,,,
4297,该 小区 的 clubhouse 包括 温泉,1,clubhouse,,,
4298,queen size 的 床,1,queen size,,,
4299,有 免费 的 bus ticket 以及 一 个 车位,1,bus ticket,,,
4300,我 因为 个人 原因 不 能 在 heights 住,1,heights,,,
4301,现在 找 想要 去 heights 住 的 朋友 接下来 lease,2,heights,lease,,
4302,college buffet 等,1,college buffet,,,
4303,不 开 party,1,party,,,
4304,off 男士 烫发 现价,1,off,,,
4305,就 在 downtown,1,downtown,,,
4306,good condition 没有 任何 问题,1,good condition,,,
4307,公寓 在 parkway plaza,1,parkway plaza,,,
4308,有 兴趣 的 女生 请 加 我 微 信 chong,1,chong,,,
4309,不 喜 party 并且 想要 住 pointe 的 女生,2,party,pointe,,
4310,pointe 很 方便,1,pointe,,,
4311,坐标 park forest apt,1,park forest apt,,,
4312,右面 的 是 cfa 官方 指定 考 试用,1,cfa,,,
4313,bus pass 也 会 免费 转交,1,bus pass,,,
4314,parkway plaza 离 百度 火锅,1,parkway plaza,,,
4315,lions crossing 地址,1,lions crossing,,,
4316,从 纽约 回 state college 的 票,1,state college,,,
4317,从 state college 到 纽约 的 票,1,state college,,,
4318,所有 办理 程序 都 是 在 leasing office 完成,1,leasing office,,,
4319,共 三 层 upper level,1,upper level,,,
4320,bus pass 价值,1,bus pass,,,
4321,bus pass 可 搭乘 n,2,bus pass,n,,
4322,可 放心 party 到 深夜 看到 这里,1,party,,,
4323,房子 离 club house 很 近,1,club house,,,
4324,可以 在 nike factory store 买 东西 超过,1,nike factory store,,,
4325,非常 适合 最近 打算 去 nike factory store 的 朋友,1,nike factory store,,,
4326,已 卖 sold,1,sold,,,
4327,求 回 村 ride,1,ride,,,
4328,房子 位于 经济 便利 的 part crest 小区,1,part crest,,,
4329,续 lease 即可,1,lease,,,
4330,没有 lease 问题,1,lease,,,
4331,大家 可以 share,1,share,,,
4332,或者 你们 已经 有 车 的 可以 给 我 提供 ride 也 可以,1,ride,,,
4333,室内 设施 和 heights 的 质量 差不多,1,heights,,,
4334,整个 小区 比较 tiny,1,tiny,,,
4335,包含 bus pass,1,bus pass,,,
4336,出租 parkway plaza 两 室 一 厅,1,parkway plaza,,,
4337,人 很 nice,1,nice,,,
4338,能 聊 能 kan,1,kan,,,
4339,无需 security deposit,1,security deposit,,,
4340,sharing 有意 的 同学,1,sharing,,,
4341,两 个 空 出来 的 房间 是 share 洗手间 的,1,share,,,
4342,需要 和 另外 一 个 人 share 洗手间,1,share,,,
4343,是 三 个 人 一起 share 的,1,share,,,
4344,在 gerald st,1,gerald st,,,
4345,离 mall 不 远,1,mall,,,
4346,undergraduate 也 可以,1,undergraduate,,,
4347,只有 spring 学期 才 有,1,spring,,,
4348,living room 提供 液晶 电视,1,living room,,,
4349,出租 ride for five,1,ride for five,,,
4350,住 在 west aaron drive,1,west aaron drive,,,
4351,是 state college 北面 的 大型 公寓 型 小区,1,state college,,,
4352,nv 和 vn 线,2,nv,vn,,
4353,cup 小 柜子,1,cup,,,
4354,住 东方 超市 附近 有 兴趣 欢迎 联系 email,1,email,,,
4355,写 报告 split screen 神器 已经 使用 了 一 段 时间 但是 非常 爱惜,1,split screen,,,
4356,住 东方 超市 附近 感兴趣 请 联系 email,1,email,,,
4357,cup 小 柜子,1,cup,,,
4358,袋 dell 鼠标,1,dell,,,
4359,个 downy 柔顺 剂,1,downy,,,
4360,st 坐 v,2,st,v,,
4361,与 apt 不同,1,apt,,,
4362,附近 有 trader,1,trader,,,
4363,gap 等 店,1,gap,,,
4364,bus pass 也 会 免费 转交,1,bus pass,,,
4365,parkway plaza 离 百度 火锅,1,parkway plaza,,,
4366,bus pass 也 会 免费 转交,1,bus pass,,,
4367,parkway plaza 离 百度 火锅,1,parkway plaza,,,
4368,bus pass 也 会 免费 转交,1,bus pass,,,
4369,parkway plaza 离 百度 火锅,1,parkway plaza,,,
4370,bus pass 也 会 免费 转交,1,bus pass,,,
4371,parkway plaza 离 百度 火锅,1,parkway plaza,,,
4372,parkway plaza 五 楼 三 人间,1,parkway plaza,,,
4373,ride for five 什么 线 都 可以 坐,1,ride for five,,,
4374,全新 木质 diploma frame,1,diploma frame,,,
4375,长途 bus 站,1,bus,,,
4376,可以 从 费城 机场 接 两 个 人和 四 件 行李 回 state college 吗,1,state college,,,
4377,求 ride 回 村里,1,ride,,,
4378,车 一直 在 audi 做 维护,1,audi,,,
4379,一 个 phd,1,phd,,,
4380,com 邮件 标题 请 注明 租房,1,com,,,
4381,接替 我 的 lease 后,1,lease,,,
4382,com 谢谢 关注,1,com,,,
4383,离 主要 grocery shopping 近,1,grocery shopping,,,
4384,现 出租 parkway plaza 一 双 人间 卧室,1,parkway plaza,,,
4385,是 离 leasing office 最近 的 那个 楼,1,leasing office,,,
4386,所以 不 需要 担心 lease 的 问题,1,lease,,,
4387,二 个 bath 房租,1,bath,,,
4388,爱 干净 不 吵闹 不 party,1,party,,,
4389,park crest terrace 小区 两 室,1,park crest terrace,,,
4390,park crest terrace 是 公认 性价比 最高 的 小区,1,park crest terrace,,,
4391,具体 房型 请 参见 park crest 官方 主页,1,park crest,,,
4392,求购 一 个 ebay 账号,1,ebay,,,
4393,新 注册 的 账号 feedback 太 低 卖 不 起来,1,feedback,,,
4394,selling limit 也 太 低 了,1,selling limit,,,
4395,现在 多 出 一 个 full size 的 床,1,full size,,,
4396,床 很 firm 很 舒服,1,firm,,,
4397,html 房子 真的 很 好,1,html,,,
4398,t 一般 会 pre,2,t,pre,,
4399,这个 plan 对于 合约 机 不 划算,1,plan,,,
4400,可以 提供 ride 到 dc 和 baltimore,3,ride,dc,baltimore,
4401,咖啡 ready to go in few minutes,1,ready to go in few minutes,,,
4402,我 可以 提供 ride,1,ride,,,
4403,one menu 是 一 个 来自 penn state 的 创业 团队,2,one menu,penn state,,
4404,现有 park forest villas 一 次 卧 出租,1,park forest villas,,,
4405,小区 近 giant,1,giant,,,
4406,最好 是 ride for five,1,ride for five,,,
4407,其实 这些 在 learner,1,learner,,,
4408,s permit 上 都 写 着,1,s permit,,,
4409,sticker 不 用 你 操心,1,sticker,,,
4410,park crest terrace 是 公认 性价比 最高 的 小区,1,park crest terrace,,,
4411,具体 房型 请 参见 http,1,http,,,
4412,入住 park crest terrace 对 收入 有 限制,1,park crest terrace,,,
4413,屋里 都 有 heater,1,heater,,,
4414,需要 的 短信 或者 email 我,1,email,,,
4415,无需 security deposit,1,security deposit,,,
4416,楼主 用 微波炉 加热 餐馆 外面 的 microwave safe container,1,microwave safe container,,,
4417,然后 也 没 去 要求 office 清理,1,office,,,
4418,那 office 清理 了 吗,1,office,,,
4419,真 希望 都 是 ladies and gentlemen serving ladies and gentlemen,1,ladies and gentlemen serving ladies and gentlemen,,,
4420,不要 找 office 理论 了,1,office,,,
4421,目前 楼主 正在 email 沟通 中,1,email,,,
4422,office 回复 了 两 个 附件 invoice,2,office,invoice,,
4423,微波炉 这里 作罢 然后 地毯 是 office 说 每 户 都 得 这样,1,office,,,
4424,office 说 你们 虽然 清理 了 但是 还有 很多 点 你们 不 知道,1,office,,,
4425,手册 上 写 着想 拿 refund 吗,1,refund,,,
4426,然后 office 来 一 句 欢迎 随时 来 拜访,1,office,,,
4427,burn 那个 office 回复 了 俩 图片,2,burn,office,,
4428,楼主 觉得 以后 新生 手册 罚 罚金 这里 除了 copper beach 和 parkway plaza,2,copper beach,parkway plaza,,
4429,这 种 连 cb 和 pp 都 不如,2,cb,pp,,
4430,至少 cb 和 pp,2,cb,pp,,
4431,不 会 charge 你,1,charge,,,
4432,charge 起来 毫不 留情,1,charge,,,
4433,原 pheasant glen,1,pheasant glen,,,
4434,但是 garden 最近 都 不 上班,1,garden,,,
4435,不 会 再 回来 和 他们 argue,1,argue,,,
4436,park crest 招租 啦,1,park crest,,,
4437,主动 提出 cover 涨价 部分,1,cover,,,
4438,共同 share 卫生间 的 是 一 个 性格 很 好 的 phd 哥哥,2,share,phd,,
4439,其他 继续 sale,1,sale,,,
4440,人 很 nice,1,nice,,,
4441,能 聊 能 kan,1,kan,,,
4442,我 是 andy,1,andy,,,
4443,我 在 state college 有 保险 办公室,1,state college,,,
4444,这 是 三 层 楼 三 个 房间 的 condo,1,condo,,,
4445,包括 在 rent 里面,1,rent,,,
4446,roommates 是 两 个 男生 phd,2,roommates,phd,,
4447,park crest 有 着 得天独厚 的 性价比 和 地理 位置 所以 一直 十分 抢手,1,park crest,,,
4448,com 欢迎 打扰,1,com,,,
4449,本人 phd 男生,1,phd,,,
4450,提供 两 个 车位 和 bus pass,1,bus pass,,,
4451,人 很 nice,1,nice,,,
4452,calculator 请 联系,1,calculator,,,
4453,walk in closet 高档 独 栋 屋,1,walk in closet,,,
4454,上课 有 r rc rp 三 条 线,1,r rc rp,,,
4455,hello 给 你 发 邮件 了,1,hello,,,
4456,没有 lease 的 问题,1,lease,,,
4457,现 有 east cherry lane house 一 个 卧室 出租,1,east cherry lane house,,,
4458,为人 超级 nice,1,nice,,,
4459,主要 想 去 匹兹堡 的 outlets,1,outlets,,,
4460,全套 gre 复习 资料,1,gre,,,
4461,各 种 刀 etc,1,etc,,,
4462,bus pass 有,1,bus pass,,,
4463,今年 的 activity fee 我 已经 交 过 了 不 会 再 收 你 的 了,1,activity fee,,,
4464,在 一 个 house 里,1,house,,,
4465,没有 lease 的 问题,1,lease,,,
4466,害怕 没有 sponsor,1,sponsor,,,
4467,你 是否 还 在 party,1,party,,,
4468,我 是 学生 党 l team player,1,l team player,,,
