sent_type,university,sent_id,original_sentence,translation,word_id,first_cs_word_form,first_cs_word_translation,frequency_first_cs_word_trans,surprisal_first_cs_word_trans,pos_tag_first_cs_word_trans,governor_first_cs_word_trans,deprel_first_cs_word_trans,bilingual_corpus_frequency_first_cs_word,bilingual_corpus_frequency_first_cs_word_trans,length_first_cs_word_form,length_first_cs_word_trans,dependency_distance,if_it_is_root,if_previous_word_is_punctuation
code-switch,PSU,1093,可以 一起 租车 ， 换 着 开 ， share 费用 。,可以 一起 租车 ， 换 着 开 ， 公共 的 费用 。,9,share,公共,2.73E-16,4.682935,JJ,11,amod,4.491408663563144E-4,4.248629816884055E-5,5,2,2,0,1
code-switch,PSU,1095,现在 一 次 卧 出租 ， 需要 与 另 一 次 卧 share 卫生间 。,现在 一 次 卧 出租 ， 需要 与 另 一 次 卧 公共 的 卫生间 。,13,share,公共,2.73E-16,4.942879,JJ,15,amod,4.491408663563144E-4,4.248629816884055E-5,5,2,2,0,0
code-switch,PSU,1096,prefer 短信 先 。,比较 喜欢 短信 先 。,1,prefer,比较,8.65E-16,4.141838,AD,2,advmod,7.283365400372666E-5,2.1243149084420275E-4,6,2,1,0,0
code-switch,PSU,1097,亲 ， 租金 和 utilities 怎么 算 的 呢 ？,亲 ， 租金 和 设备 怎么 算 的 呢 ？,5,utilities,设备,4.23E-16,3.552491,NN,7,nsubj,1.3959783684047608E-4,2.4277884667908884E-5,9,2,2,0,0
code-switch,PSU,1098,租车 费用 share 。,租车 费用 公共 的 。,3,share,公共,2.73E-16,5.076964,JJ,1,dobj,4.491408663563144E-4,4.248629816884055E-5,5,2,2,0,0
code-switch,PSU,1099,二 楼 的 是 full bathroom ， 空间 比较 大 ， 一 应 俱全 。,二 楼 的 是 完整 浴室 ， 空间 比较 大 ， 一应俱全 。,5,full,完整,1.62E-16,4.1294,JJ,6,amod,3.9451562585351936E-4,2.4277884667908884E-5,4,2,1,0,0
code-switch,PSU,1100,周围 邻居 很 安静 ， 没有 part 。,周围 邻居 很 安静 ， 没有 部分 。,7,part,部分,1.00E-15,4.530268,NN,6,dobj,6.069471166977221E-6,4.855576933581777E-5,4,2,1,0,0
code-switch,PSU,1101,车况 ： 良好 ， 无 事故 记录 ， clean title ；,车况 ： 良好 ， 无 事故 记录 ， 干净 的 头衔 ；,9,clean,干净,1.15E-17,6.066429,VA,11,amod,1.3352836567349886E-4,2.670567313469977E-4,5,2,2,0,1
code-switch,PSU,1103,hello ， 房间 已 出租 了 吗 ？,你 好 ， 房间 已 出租 了 吗 ？,1,hello,你,1.63E-15,3.991114,PN,2,nsubj,1.0318100983861277E-4,8.922122615456515E-4,5,1,1,0,0
code-switch,PSU,1109,房子 里 基本 的 家具 都 有 （ 床 是 twin size 的 ） ， utility 全 包 。,房子 里 基本 的 家具 都 有 （ 床 是 双胞胎 大 小 的 ） ， 设备 全 包 。,11,twin,双胞胎,7.12E-19,4.410765,NN,12,nsubj,7.283365400372666E-5,,4,3,1,0,0
code-switch,PSU,1111,需要 和 另外 一 个 住户 share 二 楼 的 卫生间 浴室 。,需要 和 另外 一 个 住户 公共 的 二 楼 的 卫生间 浴室 。,7,share,公共,2.73E-16,5.108754,JJ,10,amod,4.491408663563144E-4,4.248629816884055E-5,5,2,3,0,0
code-switch,PSU,1112,但 地下室 有 一 个 full bath 可以 使用 ， 不 会 有 冲突 。,但 地下室 有 一 个 完整 浴室 可以 使用 ， 不 会 有 冲突 。,6,full,完整,1.62E-16,3.453533,JJ,7,amod,3.9451562585351936E-4,2.4277884667908884E-5,4,2,1,0,0
code-switch,PSU,1113,快要 回去 了 ， 转让 meal plan 十 次 午餐 卡 。,快要 回去 了 ， 转让 饮食 计划 十 次 午餐 卡 。,6,meal,饮食,3.44E-17,5.440218,NN,7,compound:nn,6.069471166977221E-6,6.069471166977221E-6,4,2,1,0,0
code-switch,PSU,1114,因为 是 单独 一 层 ， 有 独立 卫生间 ， 所以 应该 是 男女 都 可以 住 ， 但 prefer 男生 。,因为 是 单独 一 层 ， 有 独立 卫生间 ， 所以 应该 是 男女 都 可以 住 ， 但 比较 喜欢 男生 。,20,prefer,比较,8.65E-16,3.661933,AD,21,advmod,7.283365400372666E-5,2.1243149084420275E-4,6,2,1,0,0
code-switch,PSU,1116,我们 想 是 三 个 人 的 名字 最后 都 要 在 lease 上面 ， 这样 对 大家 都 比较 好,我们 想 是 三 个 人 的 名字 最后 都 要 在 租金 上面 ， 这样 对 大家 都 比较 好,13,lease,租金,2.34E-17,5.328761,NN,14,compound:nn,6.433639436995855E-4,9.104206750465832E-5,5,2,1,0,0
code-switch,PSU,1120,没有 party ， 不 会 打扰 你 。,没有 派对 ， 不 会 打扰 你 。,2,party,派对,1.73E-18,4.509191,NN,1,dobj,2.7919567368095216E-4,6.069471166977221E-6,5,2,1,0,0
code-switch,PSU,1121,有意 ， 本人 phd 新生 ， 性格 不 爱 折腾 ， 无 不良 嗜好 ， 有意 lease 。,有意 ， 本人 研究生 新生 ， 性格 不 爱 折腾 ， 无 不良 嗜好 ， 有意 租金 。,17,lease,租金,2.34E-17,5.739749,NN,16,dobj,6.433639436995855E-4,9.104206750465832E-5,5,2,1,0,0
code-switch,PSU,1122,完 了 以后 你 就 登录 ， 然后 选 【 access my clearances 】 ， 【 create clearance application 】 然后 根据 要求 再 填 一 大 堆 信息 ， 然后 网上 付款 。,完 了 以后 你 就 登录 ， 然后 选 【 进入 我 的 权限 】 ， 【 创建 权限 申请 】 然后 根据 要求 再 填 一 大 堆 信息 ， 然后 网上 付款 。,11,access,进入,2.92E-16,3.746648,VV,9,parataxis:prnmod,6.069471166977221E-6,1.2138942333954442E-5,6,2,2,0,1
code-switch,PSU,1123,htm 打开 网页 之后 ， 点 【 register online 】 ， 根据 提示 填写 一 堆 信息 ， 然后 网上 付款 。,htm 打开 网页 之后 ， 点 【 在线 注册 】 ， 根据 提示 填写 一 堆 信息 ， 然后 网上 付款 。,8,register,在线,1.00E-17,4.796273,JJ,9,amod,6.069471166977221E-6,1.2138942333954442E-5,8,2,1,0,1
code-switch,PSU,1132,fee 里面 （ 只 用 交 一 次 ） 周边 环境 ： 离 公交 车站 近 。,钱 里面 （ 只 用 交 一 次 ） 周边 环境 ： 离 公交 车站 近 。,1,fee,钱,1.84E-16,4.461753,NN,2,compound:nn,6.676418283674943E-5,3.641682700186333E-5,3,1,1,0,0
code-switch,PSU,1133,【 hurry ， rent 】 校园 附近 公寓 出租 bbs .,【 赶快 ， 租赁 】 校园 附近 公寓 出租 bbs 。,2,hurry,赶快,7.67E-18,6.234373,AD,4,advmod,6.069471166977221E-6,6.069471166977221E-6,5,2,2,0,1
code-switch,PSU,1134,master of liberal arts 都 适用 。,文科 硕士 都 适用 。,1,master,文科,5.01E-18,5.445959,NN,2,compound:nn,6.069471166977221E-5,6.069471166977221E-6,6,2,1,0,0
code-switch,PSU,1136,本人 5/23 回国 低价 转让 one bedroom apartment .,本人 23-May 回国 低价 转让 单 卧室 公寓 。,6,one,单,1.76E-16,4.932808,JJ,7,amod,7.283365400372666E-5,2.4277884667908884E-5,3,1,1,0,0
code-switch,PSU,1140,有 自己 独立 的 卫生间 ， 只 需 share 浴室 。,有 自己 独立 的 卫生间 ， 只 需 公共 的 浴室 。,9,share,公共,2.73E-16,5.108314,JJ,11,amod,4.491408663563144E-4,4.248629816884055E-5,5,2,2,0,0
code-switch,PSU,1141,一起 新 签 lease ， 自己 顶 一下,一起 新 签 租金 ， 自己 顶 一下,4,lease,租金,2.34E-17,6.251869,NN,3,dobj,6.433639436995855E-4,9.104206750465832E-5,5,2,1,0,0
code-switch,PSU,1144,hello ， 请 问 有 没 有 需要 出售 二手 自行车 的 ？,你 好 ， 请 问 有 没 有 需要 出售 二手 自行车 的 ？,1,hello,你,1.63E-15,3.991114,PN,2,nsubj,1.0318100983861277E-4,8.922122615456515E-4,5,1,1,0,0
code-switch,PSU,1147,或者 等价 换 其他 家 的 gift card 。,或者 等价 换 其他 家 的 礼物 卡 。,7,gift,礼物,1.78E-17,4.260996,NN,8,nsubj,3.0347355834886106E-5,6.069471166977221E-6,4,2,1,0,0
code-switch,PSU,1149,老 电视 free （ 买 其他 东西 的 时候 送 ） 8 .,老 电视 免费 （ 买 其他 东西 的 时候 送 ） 8 。,3,free,免费,2.69E-17,5.319911,VV,0,root,1.3352836567349886E-4,4.4307139518933716E-4,4,2,0,1,0
code-switch,PSU,1151,有 没 有 其他 tips ？,有 没 有 其他 建议 ？,5,tips,建议,2.69E-16,4.185112,NN,1,dobj,1.2138942333954442E-5,4.855576933581777E-5,4,2,4,0,0
code-switch,PSU,1152,骗术 真 low,骗术 真 低级,3,low,低级,1.33E-17,6.142672,VA,0,root,1.2138942333954442E-5,,3,2,0,1,0
code-switch,PSU,1154,要 你 的 info .,要 你 的 信息 。,4,info,信息,8.20E-16,3.645361,NN,1,dobj,6.069471166977221E-6,2.002925485102483E-4,4,2,3,0,0
code-switch,PSU,1156,oak hill 是 属于 cooper beech 的 房产 ， 三 层 三 个 卧室 的 house ， 小区 环境 很 美 ， 房间 超大 。,橡树山 是 属于 铜山 毛榉 的 房产 ， 三 层 三 个 卧室 的 房子 ， 小区 环境 很 美 ， 房间 超大 。,15,house,房子,5.70E-17,1.373926,NN,20,nmod:topic,0.0012381721180633532,8.375870210428566E-4,5,2,5,0,0
code-switch,PSU,1157,这 次 是 仔细 问 过 office 后 的 所有 信息 。,这 次 是 仔细 问 过 办事处 后 的 所有 信息 。,7,office,办事处,6.96E-20,4.997252,NN,5,dobj,2.0636201967722553E-4,,6,3,2,0,0
code-switch,PSU,1160,问 了 office 没有 整套 空房 了 。,问 了 办事处 没有 整套 空房 了 。,3,office,办事处,6.96E-20,4.729196,NN,6,nsubj,2.0636201967722553E-4,,6,3,3,0,0
code-switch,PSU,1162,房子 面积 较 大 ， 有 1700+square feet ， 一共 分为 三 层 。,房子 面积 较 大 ， 有 1700+square 尺 ， 一共 分为 三 层 。,8,feet,尺,1.61E-17,4.669038,M,7,mark:clf,6.069471166977221E-6,,4,1,1,0,0
code-switch,PSU,1163,现在 我 因为 一些 私人 事情 要 去 加拿大 一 趟 ， 打算 申请 旅游 签证 ， 问题 是 我 现在 已经 从 学校 毕业 身份 不再 是 full time student 了 ， 然后 opt 现在 还 没有 找到 工作 ， 不 知道 这样 能 不 能 成功 申请 到 加拿大 的 旅游 签证 。,现在 我 因为 一些 私人 事情 要 去 加拿大 一 趟 ， 打算 申请 旅游 签证 ， 问题 是 我 现在 已经 从 学校 毕业 身份 不再 是 全日制 学生 了 ， 然后 选择 现在 还 没有 找到 工作 ， 不 知道 这样 能 不 能 成功 申请 到 加拿大 的 旅游 签证 。,29,full,全日制,1.08E-20,5.240804,JJ,30,amod,3.9451562585351936E-4,6.069471166977221E-6,4,3,1,0,0
code-switch,PSU,1164,因为 我 真的 是 有 事情 必须 去 一 趟 加拿大 办理 ， 所以 希望 能够 成功 办理 到 visa ， 再次 感谢 了 。,因为 我 真的 是 有 事情 必须 去 一 趟 加拿大 办理 ， 所以 希望 能够 成功 办理 到 签证 ， 再次 感谢 了 。,20,visa,签证,1.16E-17,5.116127,NN,18,dobj,1.8208413500931665E-5,4.855576933581777E-5,4,2,2,0,0
code-switch,PSU,1165,可 share 油 费 等 。,可 公共 的 油费 等 。,2,share,公共,2.73E-16,5.480459,JJ,4,amod,4.491408663563144E-4,4.248629816884055E-5,5,2,2,0,0
code-switch,PSU,1166,两 个 车位 ， 一 个 reserved 车位 。,两 个 车位 ， 一 个 预约 车位 。,7,reserved,预约,3.26E-18,6.08797,VV,0,root,6.069471166977221E-6,3.641682700186333E-5,8,2,0,1,0
code-switch,PSU,1167,我们 ： 我们 两 人 都 是 phd ， 男 ， 一 个 即将 第二 年 另 一 个 即将 第一 年 。,我们 ： 我们 两 人 都 是 研究生 ， 男 ， 一 个 即将 第二 年 另 一 个 即将 第一 年 。,8,phd,研究生,7.26E-17,4.838862,NN,0,root,2.9740408718188386E-4,7.283365400372666E-5,3,3,0,1,0
code-switch,PSU,1169,备注 写 ： ride for five 。,备注 写 ： 五 个 人 的 车 。,4,ride,五,1.75E-15,3.94647,CD,6,nummod,5.098355780260866E-4,1.153199521725672E-4,4,1,2,0,1
code-switch,PSU,1170,本人 男 ， 正 在 读 civil engineering phd 。,本人 男 ， 正在 读 土木 工程 博士 。,4,civil,正在,3.04E-16,4.528201,AD,5,advmod,6.069471166977221E-6,1.8208413500931665E-5,5,2,1,0,1
code-switch,PSU,1172,可以 一起 租车 去 ， 轮流 开车 ， share 费用 有意 请 联系 em@83,可以 一起 租车 去 ， 轮流 开车 ， 分担 费用 有意 请 联系 em@83,9,share,分担,6.85E-18,5.61336,VV,3,conj,4.491408663563144E-4,6.069471166977221E-6,5,2,6,0,1
code-switch,PSU,1176,这个 house 一 楼 有 三 个 房间 ， 有 一 间 大 房间 是 有 独立 卫生间 的 ， 其余 两 间 房间 共 享 一 个 卫生间 。,这个 房子 一 楼 有 三 个 房间 ， 有 一 间 大 房间 是 有 独立 卫生间 的 ， 其余 两 间 房间 共 享 一 个 卫生间 。,2,house,房子,5.70E-17,4.094051,NN,5,nsubj,0.0012381721180633532,8.375870210428566E-4,5,2,3,0,0
code-switch,PSU,1178,朋友 是 phd ， 讲究 个人 卫生 ， 不 打扰 别人 ， 平时 大部分 时间 在 实验室 。,朋友 是 研究生 ， 讲究 个人 卫生 ， 不 打扰 别人 ， 平时 大部分 时间 在 实验室 。,3,phd,研究生,7.26E-17,4.776312,NN,0,root,2.9740408718188386E-4,7.283365400372666E-5,3,3,0,1,0
code-switch,PSU,1182,小巧 方便 ， ask for$57 .,小巧 方便 ， 查找 $ 57 。,4,ask,查找,7.20E-18,5.794796,VV,2,ccomp,1.8208413500931665E-5,,3,2,2,0,1
code-switch,PSU,1187,每 个 房间 都 有 单独 的 closet 。,每个 房间 都 有 单独 的 衣橱 。,1,closet,每个,2.10E-19,3.587335,DT,2,det,3.095430295158383E-4,2.4277884667908884E-5,6,2,1,0,0
code-switch,PSU,1191,所以 不用 担心 被 邻居 报警 或者 周围 开 party 太 吵 。,所以 不用 担心 被 邻居 报警 或者 周围 开 派对 太 吵 。,10,party,派对,1.73E-18,2.913393,NN,9,dobj,2.7919567368095216E-4,6.069471166977221E-6,5,2,1,0,0
code-switch,PSU,1203,学校 保险 能 cover 这 部分 费用 吗 ？,学校 保险 能 包含 这 部分 费用 吗 ？,4,cover,包含,1.40E-16,3.530878,VV,9,dep,5.462524050279499E-5,1.153199521725672E-4,5,2,5,0,0
code-switch,PSU,1204,能 ， 但是 cover 不 cover 我 忘 了 。,能 ， 但是 包含 不 包含 我 忘了 。,4,cover,包含,1.40E-16,3.578778,VV,8,dep,5.462524050279499E-5,1.153199521725672E-4,5,2,4,0,0
code-switch,PSU,1209,lease 是 从 八月 开始 。,租金 是 从 八月 开始 。,1,lease,租金,2.34E-17,7.042348,NN,2,nsubj,6.433639436995855E-4,9.104206750465832E-5,5,2,1,0,0
code-switch,PSU,1210,房租 是 所有 utility 都 cover 的,房租 是 所有 设施 都 包含 的,4,utility,设施,2.41E-16,3.121864,NN,6,nsubj,3.2168197184979274E-4,9.711153867163554E-5,7,2,2,0,0
code-switch,PSU,1219,带 厨房 和 卫生间 （ 可 share ） ， 有 冰箱 。,带 厨房 和 卫生间 （ 可 公共 的 ） ， 有 冰箱 。,7,share,公共,2.73E-16,5.324547,JJ,6,dobj,4.491408663563144E-4,4.248629816884055E-5,5,2,1,0,0
code-switch,PSU,1220,我 有 驾照 ， 可以 全程 我 开 ， 费用 大家 一起 share ~,我 有 驾照 ， 可以 全程 我 开 ， 费用 大家 一起 公共 的 ~,13,share,公共,2.73E-16,4.96504,JJ,12,dobj,4.491408663563144E-4,4.248629816884055E-5,5,2,1,0,0
code-switch,PSU,1227,还有 空位 ， 去 机场 $100 / person .,还有 空位 ， 去 机场 $100  / 人 。,8,person,人,8.08E-15,3.392837,NN,5,parataxis:prnmod,1.2138942333954442E-5,0.001013601684885196,6,1,3,0,1
code-switch,PSU,1231,你 的 邮件 无法 deliver ?,你 的 邮件 无法 发出 ?,5,deliver,发出,1.61E-16,3.314783,VV,0,root,1.2138942333954442E-5,1.2138942333954442E-5,7,2,0,1,0
code-switch,PSU,1237,没有 去 jfk 机场 的 直达 shuttle 吗 ？,没有 去 肯尼迪 机场 的 直达 公共 汽车 吗 ？,7,shuttle,公共,2.73E-16,5.195465,JJ,8,amod,4.248629816884055E-5,4.248629816884055E-5,7,2,1,0,0
code-switch,PSU,1239,这 两 组 都 想 找 studio 或 one-bedroom 。,这 两 组 都 想 找 工作 室 或 one-bedroom 。,7,studio,工作,4.26E-15,2.304299,NN,8,compound:nn,1.0925048100558999E-4,1.153199521725672E-4,6,2,1,0,0
code-switch,PSU,1240,因为 有 孩子 ， shared 的 可能 比较 不 合适 。,因为 有 孩子 ， 共 享 的 可能 比较 不 合适 。,5,shared,共,2.61E-16,3.231696,AD,6,advmod,2.4277884667908884E-5,7.890312517070388E-5,6,1,1,0,1
code-switch,PSU,1245,小区 健身房 刚刚 翻新 好 ， 设备 都 是 新 的 ， 而且 就 在 office 旁边 ， 所以 离 我们 这 一 栋 很 近 。,小区 健身房 刚刚 翻新 好 ， 设备 都 是 新 的 ， 而且 就 在 办事处 旁边 ， 所以 离 我们 这 一 栋 很近 。,16,office,办事处,6.96E-20,5.452613,NN,17,compound:nn,2.0636201967722553E-4,,6,3,1,0,0
code-switch,PSU,1247,office 很 专业 也 很 nice 。,办事处 很 专业 也 很 好 。,1,office,办事处,6.96E-20,5.550694,NN,6,nsubj,2.0636201967722553E-4,,6,3,5,0,0
code-switch,PSU,1255,在家 就 可 打印 各 种 final 考试 资料 。,在家 就 可 打印 各 种 期末 考试 资料 。,7,final,期末,3.37E-18,6.722824,NN,8,compound:nn,2.4277884667908884E-5,1.2138942333954442E-5,5,2,1,0,0
code-switch,PSU,1256,我 是 今年 秋天 就 进入 第二 年 的 phd ， 生活 作息 规律 、 有 洁癖 ， 所以 希望 你 也是 非常 爱 干净 和 有 良好 作息 习惯 的 。,我 是 今年 秋天 就 进入 第二 年 的 研究生 ， 生活 作息 规律 、 有 洁癖 ， 所以 希望 你 也是 非常 爱 干净 和 有 良好 作息 习惯 的 。,10,phd,研究生,7.26E-17,4.438722,NN,0,root,2.9740408718188386E-4,7.283365400372666E-5,3,3,0,1,0
code-switch,PSU,1258,如果 你 可以 接受 你 的 名字 不 出现 在 lease 上 ， 由 我 一 个 人 去 签 lease ， 这样 也 是 ok 的 。,如果 你 可以 接受 你 的 名字 不 出 现在 租金 上 ， 由 我 一 个 人 去 签 租金 ， 这样 也 是 好 的 。,9,lease,出,2.20E-15,4.676666,VV,20,xcomp,6.433639436995855E-4,2.002925485102483E-4,5,1,11,0,0
code-switch,PSU,1261,同时 住 的 安静 ， 不 想 social 也 可以 过 一 个 安静 祥和 的 暑假 。,同时 住 的 安静 ， 不 想 社会 也 可以 过 一 个 安静 祥和 的 暑假 。,8,social,社会,5.85E-15,4.264419,NN,11,nsubj,1.2138942333954442E-5,6.069471166977221E-6,6,2,3,0,0
code-switch,PSU,1264,不用 跟 别人 share 卫生间 厨房 ！,不用 跟 别人 公共 的 卫生间 厨房 ！,4,share,公共,2.73E-16,4.82021,JJ,7,amod,4.491408663563144E-4,4.248629816884055E-5,5,2,3,0,0
code-switch,PSU,1267,车 保养 得 很 好 ， 没有 出 过 什么 问题 ， 处于 good condition 与 very good condition 之间 。,车 保养 得 很 好 ， 没有 出 过 什么 问题 ， 处于 优良 状态 与 非常 优良 状态 之间 。,14,good,优良,5.24E-17,5.518739,JJ,15,amod,3.0347355834886106E-5,1.2138942333954442E-5,4,2,1,0,0
code-switch,PSU,1272,厨房 有 一 个 早餐 bar 。,厨房 有 一 个 早餐 酒吧 。,6,bar,酒吧,5.07E-18,5.498588,NN,2,dobj,3.0347355834886106E-5,,3,2,4,0,0
code-switch,PSU,1276,我们 房间 里 有 一些 家具 ， 因为 会 搬到 furnished 的 房子 ， 可以 商量 留 一 部分 给 新 租户 。,我们 房间 里 有 一些 家具 ， 因为 会 搬到 装修 好的 的 房子 ， 可以 商量 留 一 部分 给 新 租户 。,11,furnished,装修,4.62E-18,5.598973,NN,12,nsubj,7.283365400372666E-5,7.283365400372666E-5,9,2,1,0,0
code-switch,PSU,1279,小区 非常 安静 ， 周边 很少 有 party 。,小区 非常 安静 ， 周边 很少 有 派对 。,8,party,派对,1.73E-18,5.528428,NN,7,dobj,2.7919567368095216E-4,6.069471166977221E-6,5,2,1,0,0
code-switch,PSU,1287,sorry ， 忘 了 留 联系 方式 了 ， pn-18,对不起 ， 忘 了 留 联系 方式 了 ， 626-438-7654,1,sorry,对不起,1.12E-17,5.637844,VV,0,root,2.4277884667908884E-5,6.069471166977221E-6,5,3,0,1,0
code-switch,PSU,1291,hello ， 我 也 打算 过去 呢 ， 女生 一 枚 ~,你 好 ， 我 也 打算 过去 呢 ， 女生 一 枚 ~,1,hello,你,1.63E-15,3.991114,PN,2,nsubj,1.0318100983861277E-4,8.922122615456515E-4,5,1,1,0,0
code-switch,PSU,1294,现在 仍然 available,现在 仍然 有 位置,3,available,有,1.01E-14,0.9617177,VE,0,root,2.4277884667908884E-4,0.004060476210707761,9,1,0,1,0
code-switch,PSU,1295,title 干净 ， 零 事故 。,头衔 干净 ， 零 事故 。,1,title,头衔,3.66E-18,5.550694,NN,2,nsubj,1.5780625034140776E-4,,5,2,1,0,0
code-switch,PSU,1308,lease 具体 什么 时候 开始 啊,租金 具体 什么 时候 开始 啊,1,lease,租金,2.34E-17,7.042348,NN,5,nsubj,6.433639436995855E-4,9.104206750465832E-5,5,2,4,0,0
code-switch,PSU,1310,utility 四 人 分摊 包括 ： 电 ， 气 ， 网 。,设施 四 人 分摊 包括 ： 电 ， 气 ， 网 。,1,utility,设施,2.41E-16,5.230359,NN,3,compound:nn,3.2168197184979274E-4,9.711153867163554E-5,7,2,2,0,0
code-switch,PSU,1312,可 提供 详细 的 car history 。,可 提供 详细 的 汽车 历史 。,5,car,汽车,2.53E-16,4.013315,NN,6,compound:nn,3.0347355834886106E-5,3.0347355834886106E-5,3,2,1,0,0
code-switch,PSU,1315,从不 在 家里 开 party ， 偶尔 可能 会 邀请 二三 好友 来 家里 吃饭 ， 但 一定 会 提前 告知 你 并且 获得 你 的 同意 。,从不 在 家里 开 派对 ， 偶尔 可能 会 邀请 二三 好友 来 家里 吃饭 ， 但 一定 会 提前 告知 你 并且 获得 你 的 同意 。,5,party,派对,1.73E-18,2.932171,NN,4,dobj,2.7919567368095216E-4,6.069471166977221E-6,5,2,1,0,0
code-switch,PSU,1317,房间 仍然 available ， 欢迎 各 种 咨询 ~ ~,房间 仍然 有 位置 ， 欢迎 各 种 咨询 ~ ~,3,available,有,1.01E-14,1.333217,VE,0,root,2.4277884667908884E-4,0.004060476210707761,9,1,0,1,0
code-switch,PSU,1320,oil tank 位 于 房子 地下室 。,油箱 位于 房子 地下室 。,1,oil,油箱,1.10E-19,5.976814,NN,2,nsubj,1.2138942333954442E-5,,3,2,1,0,0
code-switch,PSU,1322,距离 campus 非常 近 !,距离 校园 非常 近 !,2,campus,校园,1.88E-17,4.724013,NN,4,nmod:prep,1.2138942333954442E-5,3.641682700186333E-5,6,2,2,0,0
code-switch,PSU,1325,无线 路由器 是 cable modem 么 ？,无线 路由器 是 电缆 调制 解调器 么 ？,4,cable,电缆,5.16E-18,6.299532,NN,6,compound:nn,6.676418283674943E-5,6.069471166977221E-6,5,2,2,0,0
code-switch,PSU,1327,update 啦 ， 暑期 出租 ， 欢迎 联系 。,更新 啦 ， 暑期 出租 ， 欢迎 联系 。,1,update,更新,1.07E-16,4.512905,VV,7,dep,8.49725963376811E-5,6.069471166977221E-5,6,2,6,0,0
code-switch,PSU,1329,房屋 lease 八月 中旬 开始 ， 也 可 视 具体 情况 灵活 调整 。,房屋 租金 八月 中旬 开始 ， 也 可 视 具体 情况 灵活 调整 。,2,lease,租金,2.34E-17,5.391437,NN,5,nsubj,6.433639436995855E-4,9.104206750465832E-5,5,2,3,0,0
code-switch,PSU,1330,office 会 负责 打扫 干净 （ 包括 地毯 等等 ） ， 不用 担心 卫生 问题 。,办事处 会 负责 打扫 干净 （ 包括 地毯 等等 ） ， 不用 担心 卫生 问题 。,1,office,办事处,6.96E-20,5.550694,NN,3,nsubj,2.0636201967722553E-4,,6,3,2,0,0
code-switch,PSU,1331,office 人 也 很 nice 。,办事处 人 也 很 好 。,1,office,办事处,6.96E-20,5.550694,NN,2,compound:nn,2.0636201967722553E-4,,6,3,1,0,0
code-switch,PSU,1336,furnished ， 已 有 大多数 家具 （ 包括 书桌 ， 柜子 ， 床 ， 电视 ， 等等 ） ， 可以 即刻 拎包 入住 ， 也 可 搬家 具 入住 。,装修 好的 ， 已 有 大多数 家具 （ 包括 书桌 ， 柜子 ， 床 ， 电视 ， 等等 ） ， 可以 即刻 拎包 入住 ， 也 可 搬家 具 入住 。,1,furnished,装修,4.62E-18,5.976814,NN,2,nsubj,7.283365400372666E-5,7.283365400372666E-5,9,2,1,0,0
code-switch,PSU,1341,平时 安静 ， 不 开 party ， 大部分 时间 都 在 实验室 。,平时 安静 ， 不 开 派对 ， 大部分 时间 都 在 实验室 。,6,party,派对,1.73E-18,2.913393,NN,5,dobj,2.7919567368095216E-4,6.069471166977221E-6,5,2,1,0,0
code-switch,PSU,1342,就 这么 说 吧 ， 我 一 进 卫生间 整个 block 都 知道 我 在 上 厕所 ， 那个 声音 简直 和 拖拉机 一样 ， 毫不 夸张 。,就 这么 说 吧 ， 我 一 进 卫生间 整个 街区 都 知道 我 在 上 厕所 ， 那个 声音 简直 和 拖拉机 一样 ， 毫不 夸张 。,11,block,街区,3.81E-18,3.007144,NN,8,dobj,5.462524050279499E-5,4.248629816884055E-5,5,2,3,0,0
code-switch,PSU,1343,因为 楼主 的 车 在 final week 被 拖 了 三 次 ！,因为 楼主 的 车 在 期末 周 被 拖 了 三 次 ！,6,final,期末,3.37E-18,5.856031,NN,7,compound:nn,2.4277884667908884E-5,1.2138942333954442E-5,5,2,1,0,0
code-switch,PSU,1344,在 final week 被 拖 了 三 次 ！,在 期末 周 被 拖 了 三 次 ！,2,final,期末,3.37E-18,5.971229,NN,3,compound:nn,2.4277884667908884E-5,1.2138942333954442E-5,5,2,1,0,0
code-switch,PSU,1346,最近 让 我们 交 所谓 的 damage fee .,最近 让 我们 交 所谓 的 损坏 费用 。,7,damage,损坏,1.58E-17,4.80855,NN,8,compound:nn,6.069471166977221E-6,6.069471166977221E-6,6,2,1,0,0
code-switch,PSU,1347,建议 求助 学校 免费 的 student legal service 。,建议 求助 学校 免费 的 学生 法律 服务 。,6,student,学生,6.66E-16,3.178562,NN,8,compound:nn,5.462524050279499E-5,1.699451926753622E-4,7,2,2,0,0
code-switch,PSU,1349,楼 主 如果 没有 办 permit 为什么 不 停 visitor parking 呢 。,楼 主 如果 没有 办 许可证 为什么 不停 参观者 停车 呢 。,6,permit,许可证,3.17E-20,5.628761,NN,5,dobj,1.0925048100558999E-4,,6,3,1,0,0
code-switch,PSU,1350,没有 permit 被 拖 不 是 很 正常 吗 。,没有 许可证 被 拖 不 是 很 正常 吗 。,2,permit,许可证,3.17E-20,4.509191,NN,1,dobj,1.0925048100558999E-4,,6,3,1,0,0
code-switch,PSU,1352,若 有 人 担心 厕所 要 share ， 其实 这 并不 是 问题 ！,若 有 人 担心 厕所 要 公共 的 ， 其实 这 并不 是 问题 ！,7,share,公共,2.73E-16,4.837895,JJ,6,dobj,4.491408663563144E-4,4.248629816884055E-5,5,2,1,0,0
code-switch,PSU,1355,sorry ， 不 是 女生 。,对不起 ， 不 是 女生 。,1,sorry,对不起,1.12E-17,5.637844,VV,5,dep,2.4277884667908884E-5,6.069471166977221E-6,5,3,4,0,0
code-switch,PSU,1357,如果 只 想 从 august 开始 租 也 可以 的 ~ ~ 房子 很 干净 整洁 ， 欢迎 参观,如果 只 想 从 八月 开始 租 也 可以 的 ~ ~ 房子 很 干净 整洁 ， 欢迎 参观,5,august,八月,2.42E-19,4.166722,NT,7,nmod:prep,3.0347355834886106E-5,1.0925048100558999E-4,6,2,2,0,0
